Topic,TimeQueried,Video_Title,Video_ID,Published_AT,Duration,ViewCount,LikeCount,DislikeCount,favoriteCount,Definition,Caption
Data Science,2020-08-22 18:04:40.772675,University of Mannheim Campus Tour  (Masters in Data Science),yd4YVUDy3dw,2020-04-19T12:26:36Z,PT9M8S,10600,394,8,0,hd,false
Data Science,2020-08-22 18:04:40.772675,Columbia Engineering Executive Education | Applied Data Science | Webinar,cJkDk-TDn7M,2020-08-22T07:40:21Z,PT43M,9,2,0,0,hd,false
Data Science,2020-08-22 18:04:40.772675,Data Analytics vs Data Science: What&#39;s the difference? | How to transition into Data career?,CUpqmoJcRdA,2020-08-18T03:00:01Z,PT8M10S,495,31,1,0,hd,false
Data Science,2020-08-22 18:04:40.772675,Intro to Python in malayalam #python #datascience,6gCXtHfr1go,2020-05-24T11:37:52Z,PT9M23S,311,25,0,0,hd,false
Data Science,2020-08-22 18:04:40.772675,DIA 01 - DESAFIO DATA SCIENCE EM 100 DIAS: Como se tornar um cientista de dados do zero,6sv8AF0kvss,2019-11-12T13:27:17Z,PT1M42S,1640,148,0,0,hd,false
Data Science,2020-08-22 18:04:40.772675,SQL for Data Science and Data Scientist | Data Science Galaxy,C-GujkU61xM,2020-04-23T10:49:24Z,PT33M12S,387,18,0,0,hd,false
Data Science,2020-08-22 18:04:40.772675,15 Days Workshop on Python Application in the field of Data Science (Day - 7),wkEyyRlKhug,2020-08-18T12:36:11Z,PT2H36M12S,807,20,0,0,hd,false
Data Science,2020-08-22 18:04:40.772675,Porque estudar Data Science com a Udacity e a Tableau - TecMundo,Opc9D-CTPuQ,2018-11-23T13:18:24Z,PT11M11S,10186,730,18,0,hd,false
Data Science,2020-08-22 18:04:40.772675,O que é data science,ErqEKDdiIA8,2017-08-26T11:59:54Z,PT4M9S,25814,1194,75,0,hd,true
Data Science,2020-08-22 18:04:40.772675,What is Data Analytics,59SFeXcRpLE,2018-01-24T19:16:13Z,PT2M46S,30513,359,30,0,hd,false
Data Science,2020-08-22 18:04:40.772675,AI vs ML vs DL vs Data Science,pIMJyHCkHL4,2020-06-26T03:30:06Z,PT4M47S,190,14,0,0,hd,false
Data Science,2020-08-22 18:04:40.772675,Como Aprender Data Science com Python,C6eKuZ2PVDE,2019-09-07T23:12:43Z,PT14M13S,5756,403,1,0,hd,false
Data Science,2020-08-22 18:04:40.772675,Data Science: É de comer?,Enxdz-j_A-s,2019-12-14T03:52:52Z,PT1H17M45S,512,59,2,0,hd,false
Data Science,2020-08-22 18:04:40.772675,Odia vlog | Data Science as career in USA | 5 mins Atta ganesh| odia vlogger in america |ଓଡ଼ିଆ ବ୍ଲଗ,MTdVX1BBF8E,2020-08-21T15:56:24Z,PT14M13S,236,NA,NA,0,hd,false
Data Science,2020-08-22 18:04:40.772675,Performing SQL Queries In R | Data Science Galaxy,VmxGLzOv2-A,2020-04-25T13:24:27Z,PT16M54S,762,13,0,0,hd,false
Data Science,2020-08-22 18:04:40.772675,Data Science for Computational Drug Discovery using Python (Part 2 with PyCaret),RGfeGRt32Dk,2020-08-09T10:04:39Z,PT19M12S,3732,114,1,0,hd,false
Data Science,2020-08-22 18:04:40.772675,15 Days Workshop on Python Application in the field of Data Science (Day - 8),r9W1m1iikdE,2020-08-19T11:42:37Z,PT2H41M36S,666,25,0,0,hd,false
Data Science,2020-08-22 18:04:40.772675,Standard Normal Distribution (SDS23 by Myanmar Data Science),GFuaY7VWJqk,2020-08-20T13:03:02Z,PT14M41S,40,9,0,0,sd,false
Data Science,2020-08-22 18:04:40.772675,"Specialisti dei dati, i primi laureati in Data science",9qg-auPGJCA,2019-10-28T13:14:47Z,PT3M5S,2391,44,1,0,hd,false
Data Science,2020-08-22 18:04:40.772675,3 diferencias entre 💻 R vs Python 🐍 para DATA SCIENCE,doLXHVBbknw,2020-07-17T13:45:16Z,PT6M47S,2646,240,2,0,hd,true
Data Science,2020-08-22 18:04:40.772675,От прокрастинации до Data Science за 6 месяцев. Потерять и найти мотивацию,IUDt6-Jl3gc,2020-04-22T04:57:07Z,PT32M23S,95760,1815,241,0,hd,false
Data Science,2020-08-22 18:04:40.772675,5 Day Data Science Workshop | data science for beginners | Shashwat Testimonials,3Dj2kC45Zz0,2020-08-21T14:56:51Z,PT56S,28,2,1,0,hd,false
Data Science,2020-08-22 18:04:40.772675,Career growth opportunities in Data Science | Deloitte Data Scientist,aS1x3lQRzYw,2020-04-30T14:24:22Z,PT3M46S,150,0,0,0,sd,false
Data Science,2020-08-22 18:04:40.772675,Data Science para el desarrollo de Santo Domingo,y874d0CNRj0,2020-08-14T21:44:44Z,PT29M40S,1107,116,0,0,hd,false
Data Science,2020-08-22 18:04:40.772675,Data Science Dengan Pendekatan Machine Learning : Part 1 - Dasar Pemrograman Python,uB9GxkYnfVo,2020-05-10T05:06:37Z,PT24M36S,447,18,0,0,hd,false
Data Science,2020-08-22 18:04:40.772675,Python VS R: Melhor Linguagem para Data Science | Bit de Prosa #11,W3J7EiSXAO0,2019-12-02T21:00:02Z,PT24M55S,28594,2768,33,0,hd,false
Data Science,2020-08-22 18:04:40.772675,Let&#39;s Deploy a Machine Learning Model | Better Data Science,fXscLoI4bic,2020-06-25T21:03:06Z,PT10M46S,187,9,1,0,hd,false
Data Science,2020-08-22 18:04:40.772675,Real World Data Science - A Great Way to Start you Data Science Journey,91BeUdUonDU,2020-08-21T09:21:18Z,PT4M9S,29,2,0,0,hd,false
Data Science,2020-08-22 18:04:40.772675,Enabling Scalable Data Science Pipeline with Mlflow at Thermo Fisher Scientific,nNrIf-P58WY,2020-08-18T15:35:16Z,PT32M33S,222,1,0,0,hd,false
Data Science,2020-08-22 18:04:40.772675,"The What, Why &amp; How of Maths in AI, ML, Data Science journey",6lfVebESG00,2020-08-16T20:26:07Z,PT1H46M36S,1380,NA,NA,0,hd,false
Data Science,2020-08-22 18:04:40.772675,Introduction to Data Science in Python Week 4 || Assignment 4 Programming Assignment Coursera,C-J17s9F_W4,2020-07-18T16:40:09Z,PT2M2S,69,1,0,0,hd,false
Data Science,2020-08-22 18:04:40.772675,"IIT Roorkee Online Certificate Courses | Data Science, AI, and ML",m5WM82QqUwU,2020-08-19T09:59:59Z,PT4M11S,440,12,3,0,hd,false
Data Science,2020-08-22 18:04:40.772675,15 Days Workshop on Python Application in the field of Data Science (Day - 9),cmRX0lnVu2E,2020-08-20T11:29:32Z,PT2H21M15S,537,21,0,0,hd,false
Data Science,2020-08-22 18:04:40.772675,Episode 14 -Top AI &amp; DataScience News from the week | 21 st Aug 2020,uwSwyICKTRg,2020-08-21T06:45:10Z,PT5M7S,546,31,0,0,hd,false
Data Science,2020-08-22 18:04:40.772675,10 Powerful YouTube Channels for Data Science Aspirants! | Learn Data Science on YouTube 🤩🤩,nXlc1bQ12y4,2020-08-14T12:27:52Z,PT9M13S,1505,104,3,0,hd,false
Data Science,2020-08-22 18:04:40.772675,The Life of Data Science,x6talOP-Ej4,2018-08-15T12:45:09Z,PT1M28S,1258,24,5,0,hd,false
Data Science,2020-08-22 18:04:40.772675,Summary Wednesday Live- Counter Strike Gameplay &amp; Data Science Q&amp;A,QPycmeIwKw8,2020-08-20T10:37:17Z,PT24M8S,170,8,0,0,hd,false
Data Science,2020-08-22 18:04:40.772675,DATA SCIENCE ETHICS||MODULE-04||QUIZ||,iI0XnB_77-8,2020-05-23T11:37:12Z,PT36S,377,3,0,0,hd,false
Data Science,2020-08-22 18:04:40.772675,Data Science Workshop - Part 2: Oracle Products overview,lnsqix1UdpQ,2020-08-18T17:19:40Z,PT17M16S,36,1,0,0,hd,false
Data Science,2020-08-22 18:04:40.772675,Exclusive Interview with Nikita Kar | Big Data Developer | Data Science Enthusiast | Full Detail 🔥,E-HJX1KzzLs,2020-08-18T13:30:00Z,PT31M13S,480,80,5,0,hd,false
Data Science,2020-08-22 18:04:40.772675,The YouTube Algorithm EXPLAINED! (By a Data Scientist),YbTMIxjk4hI,2020-08-14T15:00:31Z,PT9M4S,3489,347,5,0,hd,false
Data Science,2020-08-22 18:04:40.772675,Friday Live- Cricket 19 Gameplay &amp; Data Science Q&amp;A,JQTmzG_X8YU,2020-08-22T06:14:17Z,PT1H11M12S,311,25,2,0,hd,false
Data Science,2020-08-22 18:04:40.772675,"Decoding Artificial intelligence with Mayur Datar, Chief Data Scientist, Flipkart",BuuOLZihnKU,2020-08-19T06:12:07Z,PT40M6S,1167,73,0,0,hd,false
Data Science,2020-08-22 18:04:40.772675,Thursday Live- Becoming Pro In Gameplays &amp; Data Science Q&amp;A,6vlH2UdF7nY,2020-08-21T05:54:51Z,PT49M52S,313,22,1,0,hd,false
Data Science,2020-08-22 18:04:40.772675,Data Types for Data Science in Python: Counting made easy,dfgIoThVpkc,2020-08-19T00:14:53Z,PT1M33S,160,7,0,0,hd,false
Data Science,2020-08-22 18:04:40.772675,Amazon Data Science 面试技巧,GAVzS38REEg,2020-08-17T04:50:35Z,PT19M51S,283,2,0,0,hd,false
Data Science,2020-08-22 18:04:40.772675,Live Q&amp;A Data Science By Krish And Sudhanshu- Give Away For Women To Promote AI,tdXkUPTZIzk,2020-08-16T16:23:03Z,PT58M59S,10666,381,20,0,hd,false
Data Science,2020-08-22 18:04:40.772675,Data Science &amp; Machine Learning with Python || Class - 5|| by Mrs. Sasmitha on 18-08-2020 @ 8:30PM,rgzVV0IZlsk,2020-08-19T02:51:38Z,PT29M4S,141,5,0,0,hd,false
Data Science,2020-08-22 18:04:40.772675,Como ser Freelancer em Data Science,ggdXJJNh7-k,2020-04-23T12:24:29Z,PT1H19M3S,8303,521,10,0,hd,false
Data Science,2020-08-22 18:04:40.772675,Devops In Data Science: reclaiming 80% of your time - Alex Remedios,HPF3ZLTIErw,2020-08-20T14:05:00Z,PT56M45S,54,3,0,0,sd,false
Data Science,2020-08-22 18:04:40.772675,Three Decades of Practising Data Science | Interview with Dean Abbott,7rWXSySPt0g,2020-08-20T19:30:28Z,PT49M19S,105,19,0,0,hd,false
Data Science,2020-08-22 18:04:40.772675,Best Data Science Project to Get Internship or Job (especially if you have no experience),2goqyY5XBeI,2020-08-20T23:22:21Z,PT6M26S,210,24,0,0,hd,false
Data Science,2020-08-22 18:04:40.772675,Wednesday Live- Counter Strike Gameplay &amp; Data Science Q&amp;A,4muGsnAvX_c,2020-08-20T08:32:43Z,PT1H4M12S,357,24,1,0,hd,false
Data Science,2020-08-22 18:04:40.772675,Deploying and Scaling Data Science Tools on Distributed Systems,Db4Gk18bs50,2020-08-21T02:12:04Z,PT1H8M36S,181,13,0,0,hd,false
Data Science,2020-08-22 18:04:40.772675,Titanic Machine Learning Competition| Part II |Data Science Malayalam | Kaggle,NZ_YLTAV6eo,2020-08-22T11:48:25Z,PT23M21S,5,1,0,0,hd,false
Data Science,2020-08-22 18:04:40.772675,NSU Data Science,9fgnAfPVgl0,2020-08-20T13:00:12Z,PT1M,12,2,0,0,hd,false
Data Science,2020-08-22 18:04:40.772675,Sabudh Data Science Pro 2020 Webinar with Dr. Vikram Vij,8AllHntV3QE,2020-08-22T07:11:25Z,PT1H3M45S,31,1,0,0,hd,false
Data Science,2020-08-22 18:04:40.772675,"Basics of AI, ML and Data Science",kloBJUR9o-M,2020-08-20T12:23:09Z,PT1H13M16S,261,23,0,0,hd,false
Data Science,2020-08-22 18:04:40.772675,Learn Data Science with Venturenix Lab!,qh4qWjOr95I,2020-08-18T04:04:04Z,PT19S,1704,0,0,0,hd,false
Data Science,2020-08-22 18:04:40.772675,"Data Scientist- Python and R, Genpact | DataStar Ep #15",mlw56NFb1jA,2020-08-17T11:30:02Z,PT11M,135,3,0,0,hd,false
Data Science,2020-08-22 18:04:40.772675,Is it worth to pay high salary for Data Scientist? ( Why such a hype?),wllsAFnY4Cc,2020-08-18T03:42:49Z,PT3M57S,141,21,0,0,hd,false
Data Science,2020-08-22 18:04:40.772675,15 Days Workshop On Application Of Data Science Through Python In Collab with JNTU(K),t7ygzZGBAyM,2020-08-18T08:38:32Z,PT3H30M27S,198,6,0,0,hd,false
Data Science,2020-08-22 18:04:40.772675,Algorithms affect lives: social equality efforts need good data science,tuBJrM5xaMM,2020-08-21T18:05:50Z,PT2M18S,0,0,0,0,hd,false
Data Science,2020-08-22 18:04:40.772675,IIT Madras Online B.Sc. Degree/Diploma in Programming and Data Science | Anyone Can Apply,gV0_qt2L6Mg,2020-08-21T09:22:26Z,PT13M22S,512,34,6,0,hd,false
Data Science,2020-08-22 18:04:40.772675,Experiment 4| Data science | python,Yp3DN5tca0M,2020-08-22T09:13:28Z,PT6M5S,40,0,0,0,hd,false
Data Science,2020-08-22 18:04:40.772675,Data Analyst/Data Analytics Course in association with APSSDC - Session 13,QXUXTAy8uaQ,2020-08-19T08:17:12Z,PT2H10M32S,697,14,0,0,hd,false
Data Science,2020-08-22 18:04:40.772675,2020/08/19  --  Study Hall for Galvanize Data Science Immersive Prep,O2BAVVKgIt0,2020-08-21T21:11:14Z,PT1H36M24S,48,1,0,0,hd,false
Data Science,2020-08-22 18:04:40.772675,"Alumni Spotlight: Josefa Sullivan, Senior Data Scientist at MeiraGTx",r-utzsJp7Ag,2020-08-18T19:28:01Z,PT3M17S,165,2,0,0,hd,false
Data Science,2020-08-22 18:04:40.772675,Ayiti Analytics Data Science Bootcamp: Virtual Capstone Presentations,wlyOB4FUfsU,2020-08-21T03:06:25Z,PT2H23M21S,100,8,0,0,hd,false
Data Science,2020-08-22 18:04:40.772675,Daffodil International Academy to offer NCC Education Short Courses in Data Science,cK5KfkB0BIc,2020-08-20T14:21:43Z,PT1M14S,15,1,0,0,hd,false
Data Science,2020-08-22 18:04:40.772675,Data Science в НГУ,3oGfnUM8Hxw,2020-08-20T13:00:12Z,PT1M4S,26,2,1,0,hd,false
Data Science,2020-08-22 18:04:40.772675,Data Analyst Interview Questions &amp; Answers | Data Analytics Jobs Resume Building,0vfu92FFkGA,2020-08-19T14:09:19Z,PT1H31M49S,1055,83,0,0,hd,false
Data Science,2020-08-22 18:04:40.772675,Data Analyst/Data Analytics Course in association with APSSDC - Session 12,TIz9FWVeNXQ,2020-08-18T08:13:48Z,PT2H5M20S,1007,29,0,0,hd,false
Data Science,2020-08-22 18:04:40.772675,DAT&#39;s Data Analytics team examines current freight market conditions: Ep. 119,tBa2djQWuZk,2020-08-20T00:00:12Z,PT22M23S,279,9,0,0,hd,true
Data Science,2020-08-22 18:04:40.772675,#9 Python Operators | Assignment Operators | Learn Python for Data Science,BXdZ5ILe6gQ,2020-08-18T09:02:57Z,PT5M13S,14,4,0,0,hd,false
Data Science,2020-08-22 18:04:40.772675,Tutorial Export Import CSV Excel di R #09 - Data Science Masterclass Menggunakan R,e79EzxD2yQE,2020-08-20T22:31:58Z,PT16M10S,38,9,0,0,hd,false
Data Science,2020-08-22 18:04:40.772675,Machine Learning and Data Science Using Python in Malayalam | Trycle e-learning in Malayalam,7kmlTkqWwvc,2020-08-20T03:54:15Z,PT57S,11,3,0,0,hd,false
Data Science,2020-08-22 18:04:40.772675,Data Analyst/Data Analytics Course in association with APSSDC - Session 10,VE-UeYNUHSg,2020-08-14T08:10:44Z,PT2H32M11S,1349,25,0,0,hd,false
Data Science,2020-08-22 18:04:40.772675,المجالات المتعلقة بعلم البيانات | Data Science Related Fields,BRV9cr-l4ww,2020-08-19T20:00:10Z,PT9M11S,186,27,0,0,hd,false
Data Science,2020-08-22 18:04:40.772675,KPMG Remote/Virtual Data Science Internships for every Students in  2020,cIfgbbPN25o,2020-08-18T06:11:50Z,PT6M6S,496,73,1,0,hd,false
Data Science,2020-08-22 18:04:40.772675,SQL for Data Science | Learn SQL in under 45 minutes | Learn SQL Database for Data Science | Part 2,F_CfUuvpqWI,2020-08-21T14:21:25Z,PT39M29S,30,9,0,0,hd,false
Data Science,2020-08-22 18:04:40.772675,Python for Data Science - Episode 5 | JUHSC’s Python Certification Course 2020 | Bangla |,pPDXKjvqrEs,2020-08-20T10:18:43Z,PT2H11M54S,19,1,0,0,hd,false
Data Science,2020-08-22 18:04:40.772675,Karachi AI : Meetup X - Delivering Data Science Applications,HeTVxx51MNM,2020-08-22T06:07:12Z,P0D,163,14,0,0,sd,false
Data Science,2020-08-22 18:04:40.772675,Webinar : THE NEEDS OF DATA ANALYTICS IN INDUSTRY,KUFSpmbxgiQ,2020-08-19T09:16:59Z,PT2H15M1S,1540,84,1,0,hd,false
Data Science,2020-08-22 18:04:40.772675,"Daata {HD &amp; Eng Subs} - Hindi Full Movie - Mithun Chakraborty, Shammi Kapoor, Padmini Kolhapure",gUuosA9eQ7s,2018-03-13T14:30:01Z,PT2H50M45S,6136605,12322,5953,0,hd,true
Data Science,2020-08-22 18:04:40.772675,"Daddy || Telugu Full Movie || Chiranjeevi, Simran , Rajendra Prasad",-oZh1AqgoI8,2011-05-27T10:34:26Z,PT2H36M21S,6307722,18121,4270,0,hd,false
Data Science,2020-08-22 18:04:40.772675,🎥 SPECTRAL (2016) | Full Movie Trailer in Full HD | 1080p,WIBfKXZpKAQ,2018-07-30T13:00:05Z,PT2M7S,87337,345,20,0,hd,false
Machine Learning,2020-08-22 18:04:40.772675,MIT Introduction to Deep Learning | 6.S191,njKP3FqW3Sk,2020-02-08T14:40:57Z,PT52M52S,511934,11320,96,0,hd,true
Machine Learning,2020-08-22 18:04:40.772675,Machine Learning at Amazon India,_wE4-Q8y5Uw,2018-08-21T07:38:30Z,PT3M54S,21459,101,1,0,hd,false
Machine Learning,2020-08-22 18:04:40.772675,Unsupervised Learning | Clustering and Association Algorithms in Machine Learning | @edureka!,UhVn2WrzMnI,2019-12-06T04:38:48Z,PT23M19S,23659,361,26,0,hd,false
Machine Learning,2020-08-22 18:04:40.772675,Machine Learning Tutorial Python - 8:  Logistic Regression (Binary Classification),zM4VZR0px8E,2018-09-07T12:15:33Z,PT19M19S,102907,1520,33,0,hd,false
Machine Learning,2020-08-22 18:04:40.772675,COVID - 19 Outbreak Prediction using Machine Learning | Machine Learning Training | Edureka,_Hi6_JQesSQ,2020-03-29T08:32:12Z,PT1H1M6S,76750,1529,47,0,hd,false
Machine Learning,2020-08-22 18:04:40.772675,"What is backpropagation really doing? | Deep learning, chapter 3",Ilg3gGewQ5U,2017-11-03T14:03:37Z,PT13M54S,1965138,35701,301,0,hd,true
Machine Learning,2020-08-22 18:04:40.772675,How to get machine learning jobs? | Technical Skills Required to Become a Machine Learning Engineer,w-ere0D1od0,2020-02-28T16:24:59Z,PT18M27S,7539,282,4,0,hd,false
Machine Learning,2020-08-22 18:04:40.772675,Il tuo primo script di Machine Learning in Python,hSZH6saoLBY,2018-07-31T09:15:50Z,PT9M12S,20284,522,14,0,hd,false
Machine Learning,2020-08-22 18:04:40.772675,Machine Learning: Living in the Age of AI | A WIRED Film,ZJixNvx9BAc,2019-06-20T16:00:06Z,PT41M17S,862490,16338,541,0,hd,false
Machine Learning,2020-08-22 18:04:40.772675,"Deep learning - Yann LeCun, à l&#39;USI",RgUcQceqC_Y,2015-07-13T14:50:44Z,PT44M13S,167181,1355,62,0,hd,false
Machine Learning,2020-08-22 18:04:40.772675,Seu primeiro código de Machine Learning com Python!,DNegkxwQJuY,2019-07-08T23:55:29Z,PT28M57S,32220,1869,20,0,hd,false
Machine Learning,2020-08-22 18:04:40.772675,Data Science Project- Credit Card Fraud Detection using Machine Learning | Python Training |Edureka,PmssNOAeqdk,2020-04-03T13:58:33Z,PT20M43S,13282,271,9,0,hd,false
Machine Learning,2020-08-22 18:04:40.772675,JAX: Accelerated Machine Learning Research | SciPy 2020 | VanderPlas,z-WSrQDXkuM,2020-07-05T13:14:48Z,PT23M40S,5883,225,0,0,hd,false
Machine Learning,2020-08-22 18:04:40.772675,Predicting Titanic Survivors With Machine Learning,fS70iptz-XU,2017-12-26T17:30:00Z,PT51M10S,55979,972,20,0,hd,false
Machine Learning,2020-08-22 18:04:40.772675,Machine Learning Bangla Tutorial - Introduction (মেশিন লার্নিং),thZ1MSumZX0,2018-12-11T13:00:12Z,PT14M28S,13687,NA,NA,0,hd,false
Machine Learning,2020-08-22 18:04:40.772675,"Machine Learning Engineer Jobs, Resume &amp; Salary | Machine Learning Engineer Salary Report | Edureka",uMxQI2tJtKQ,2019-01-03T05:41:44Z,PT17M40S,67695,1143,64,0,hd,false
Machine Learning,2020-08-22 18:04:40.772675,An introduction to Reinforcement Learning,JgvyzIkgxF0,2018-04-02T20:54:48Z,PT16M27S,281496,8774,114,0,hd,false
Machine Learning,2020-08-22 18:04:40.772675,Machine Learning Algorithm- Which one to choose for your Problem?,38SUUaMX5Rg,2019-05-30T15:30:45Z,PT21M33S,29228,1186,18,0,hd,false
Machine Learning,2020-08-22 18:04:40.772675,Robot uses machine learning to harvest lettuce,EFC3OvkVKaQ,2019-07-08T11:43:57Z,PT47S,67473,134,4,0,hd,false
Machine Learning,2020-08-22 18:04:40.772675,Python Chat Bot Tutorial - Chatbot with Deep Learning (Part 1),wypVcNIH6D4,2019-05-28T00:44:52Z,PT16M11S,397407,6554,138,0,hd,false
Machine Learning,2020-08-22 18:04:40.772675,Lecture 1 | Machine Learning (Stanford),UzxYlbK2c7E,2008-07-23T01:58:21Z,PT1H8M40S,2429885,14038,284,0,sd,false
Machine Learning,2020-08-22 18:04:40.772675,Art in the age of machine intelligence | Refik Anadol,UxQDG6WQT5s,2020-08-19T13:44:56Z,PT12M2S,77763,2792,94,0,hd,false
Machine Learning,2020-08-22 18:04:40.772675,Covid19 Machine Learning Prediction and Forecasting | Time Series Analysis | Codegnan,1yG4mn3Tv70,2020-04-28T07:17:31Z,PT2H30M28S,4188,121,2,0,hd,false
Machine Learning,2020-08-22 18:04:40.772675,Hello World - Machine Learning Recipes #1,cKxRvEZd3Mw,2016-03-30T16:59:12Z,PT6M53S,2468397,54030,547,0,hd,true
Machine Learning,2020-08-22 18:04:40.772675,¿Qué es el Machine Learning?¿Y Deep Learning? Un mapa conceptual | DotCSV,KytW151dpqU,2017-11-01T20:53:19Z,PT7M47S,254246,9764,75,0,hd,false
Machine Learning,2020-08-22 18:04:40.772675,11. Introduction to Machine Learning,h0e2HAPTGF4,2017-05-19T14:22:40Z,PT51M31S,769647,9839,226,0,hd,true
Machine Learning,2020-08-22 18:04:40.772675,Facial Recognition | How does Facial Recognition work? | Machine Learning Applications | Edureka,GHx_2AN47ic,2020-07-23T18:26:10Z,PT2M20S,5989,140,9,0,hd,false
Machine Learning,2020-08-22 18:04:40.772675,Introduction to Deep Learning: What Is Deep Learning?,3cSjsTKtN9M,2017-03-27T15:09:37Z,PT3M34S,111890,1068,25,0,hd,true
Machine Learning,2020-08-22 18:04:40.772675,Super-Human Performance in Gran Turismo Sport Using Deep Reinforcement Learning,Zeyv1bN9v4A,2020-08-19T14:44:07Z,PT3M18S,8884,222,1,0,hd,false
Machine Learning,2020-08-22 18:04:40.772675,Tutorial 48- Naive Bayes&#39; Classifier Indepth Intuition-  Machine Learning,jS1CKhALUBQ,2020-04-20T18:01:29Z,PT15M55S,17938,661,5,0,hd,false
Machine Learning,2020-08-22 18:04:40.772675,I show 16-inch MacBook Pro&#39;s real-world performance on MACHINE LEARNING algorithms,Lq_XZ8ChxyQ,2020-06-30T18:57:30Z,PT7M1S,3888,206,3,0,hd,false
Machine Learning,2020-08-22 18:04:40.772675,10 Machine Learning &amp; Deep Learning Project Ideas for Resume | For a B.Tech Student | Prateek Narang,zzAtB5V4AUQ,2020-03-13T16:30:10Z,PT14M26S,31864,895,19,0,hd,false
Machine Learning,2020-08-22 18:04:40.772675,Makine Öğrenmesi (Machine Learning) Hakkında,oQDeVVTzVPA,2018-08-28T18:23:48Z,PT22M32S,45296,1291,57,0,hd,false
Machine Learning,2020-08-22 18:04:40.772675,Azure Machine Learning Studio,JNa4VV0d8T0,2019-11-12T18:00:00Z,PT9M2S,9314,136,1,0,hd,true
Machine Learning,2020-08-22 18:04:40.772675,"Vừa ăn mỳ vừa lập trình AI, machine learning :))",2okN7BqvE6I,2019-03-05T06:00:28Z,PT1H41M7S,112372,2243,90,0,hd,false
Machine Learning,2020-08-22 18:04:40.772675,Naive Bayes Classifier in Python | Naive Bayes Algorithm | Machine Learning Algorithm | Edureka,vz_xuxYS2PM,2018-07-26T14:07:41Z,PT30M19S,122407,1220,130,0,hd,false
Machine Learning,2020-08-22 18:04:40.772675,Top Machine Learning Tools and Frameworks for Beginners | Machine Learning Tutorial | Edureka,v0uVu5__JGg,2019-08-08T05:59:56Z,PT12M3S,18909,483,11,0,hd,false
Machine Learning,2020-08-22 18:04:40.772675,Deep Learning 1: Introduction to Machine Learning Based AI,iOh7QUZGyiU,2018-11-23T11:25:52Z,PT1H43M8S,118514,1232,11,0,hd,false
Machine Learning,2020-08-22 18:04:40.772675,The 7 steps of machine learning,nKW8Ndu7Mjw,2017-08-31T19:19:11Z,PT10M36S,1807881,29456,712,0,hd,true
Machine Learning,2020-08-22 18:04:40.772675,Apa itu Machine Learning? Inilah cara mudah memahami Machine Learning,-G5-kHF57OU,2019-03-17T16:53:35Z,PT8M20S,9865,210,4,0,sd,false
Machine Learning,2020-08-22 18:04:40.772675,Machine learning 1 - 5. Teachable machine,F5SUlHhjYCk,2020-08-12T12:23:32Z,PT8M24S,9715,204,2,0,hd,false
Machine Learning,2020-08-22 18:04:40.772675,The future will not be supervised... | Machine Learning Monthly July 2020,3IKWukTiBfc,2020-08-09T06:06:03Z,PT26M28S,6282,246,0,0,hd,false
Machine Learning,2020-08-22 18:04:40.772675,AI &amp; Machine Learning Will Change UX Research &amp; Design,mBu_LmD69tc,2020-08-21T16:30:02Z,PT11M30S,557,29,0,0,hd,false
Machine Learning,2020-08-22 18:04:40.772675,Python Machine Learning Tutorial #2 - Linear Regression p.1,45ryDIPHdGg,2019-01-17T20:00:01Z,PT14M48S,208454,3695,58,0,hd,false
Machine Learning,2020-08-22 18:04:40.772675,The Deep Learning Revolution,Dy0hJWltsyE,2016-06-09T22:52:25Z,PT2M36S,143719,2436,57,0,hd,false
Machine Learning,2020-08-22 18:04:40.772675,Mathematics for Machine Learning [Full Course] | Essential Math for Machine Learning | Edureka,1VSZtNYMntM,2020-01-10T14:00:00Z,PT1H46M10S,73440,2115,65,0,hd,false
Machine Learning,2020-08-22 18:04:40.772675,FORMATION PYTHON MACHINE LEARNING (2020) (1/30),82KLS2C_gNQ,2019-09-03T14:00:13Z,PT8M30S,87348,3369,7,0,hd,true
Machine Learning,2020-08-22 18:04:40.772675,1. Artificial Intelligence and Machine Learning,t4K6lney7Zw,2020-06-25T17:31:35Z,PT1H14M24S,63413,2332,16,0,hd,true
Machine Learning,2020-08-22 18:04:40.772675,4.1 Apa itu machine learning?,keUHfUrlbq0,2018-02-21T15:40:08Z,PT9M25S,19277,550,6,0,hd,false
Machine Learning,2020-08-22 18:04:40.772675,Coursera Machine Learning Course from Stanford University| Get Certificate on Financial Aid for Free,w-uLmRVKnt4,2020-07-31T12:14:20Z,PT8M33S,1904,81,4,0,hd,false
Machine Learning,2020-08-22 18:04:40.772675,A Day In The Life Of A Machine Learning Engineer | Learning Intelligence 36,Eaj7pNeIQhs,2018-07-21T14:32:52Z,PT9M7S,149227,1754,375,0,hd,false
Machine Learning,2020-08-22 18:04:40.772675,Finally Built My Deep Learning And Gaming Workstation With Nvidia Titan RTX GPU 🔥🔥🔥🔥🔥- It&#39;s A Beast🔥,qxPWdaOOnHg,2020-08-20T05:01:24Z,PT11M6S,12707,570,22,0,hd,false
Machine Learning,2020-08-22 18:04:40.772675,MIT Deep Learning Basics: Introduction and Overview,O5xeyoRL95U,2019-01-11T16:47:40Z,PT1H8M6S,655585,12282,259,0,hd,true
Machine Learning,2020-08-22 18:04:40.772675,Machine Learning with R | Machine Learning Algorithms | Data Science Training | Edureka,SeyghJ5cdm4,2018-04-02T14:06:13Z,PT40M36S,63227,729,17,0,hd,false
Machine Learning,2020-08-22 18:04:40.772675,kaggle 03 | Belajar Machine Learning Dasar dengan Python | Machine Learning Pemula Bahasa Indonesia,DY10uyDy3vQ,2020-01-22T07:37:32Z,PT33M38S,5065,184,1,0,hd,false
Machine Learning,2020-08-22 18:04:40.772675,Learn Machine Learning and Artificial Intelligence Course Full Online | ML and AI Course,GhTREKMYp34,2020-06-01T05:32:42Z,PT11H15M39S,18411,1190,21,0,hd,false
Machine Learning,2020-08-22 18:04:40.772675,Intro to machine learning on Google Cloud Platform (Google I/O &#39;18),gVz9jKE_9iU,2018-05-10T22:01:03Z,PT39M19S,66234,937,24,0,hd,true
Machine Learning,2020-08-22 18:04:40.772675,Linear Regression Analysis | Linear Regression in Python | Machine Learning Algorithms | Simplilearn,NUXdtN1W1FE,2018-03-26T14:39:17Z,PT35M46S,154405,2038,47,0,hd,false
Machine Learning,2020-08-22 18:04:40.772675,"Lecture 2: Machine Learning 1 - Linear Classifiers, SGD | Stanford CS221: AI (Autumn 2019)",zrT2qETJilw,2020-01-08T19:22:26Z,PT1H20M34S,28386,462,8,0,hd,true
Machine Learning,2020-08-22 18:04:40.772675,Scikit Learn Tutorial | Machine Learning with Python | Python for Data Science Training | Edureka,bwZ3Qiuj3i8,2018-04-18T12:26:57Z,PT37M8S,136820,1221,161,0,hd,false
