Topic,TimeQueried,Video_Title,Video_ID,Published_AT,Duration,ViewCount,LikeCount,DislikeCount,favoriteCount,Definition,Caption
Artificial Intelligence,2020-08-22 18:04:40.772675,Artificial Intelligence: The Future of AI in Digital Marketing,gFEhuhlRTbs,2019-12-11T18:30:06Z,PT56M40S,3070,66,2,0,hd,false
Artificial Intelligence,2020-08-22 18:04:40.772675,Why the world is at a turning point with artificial intelligence and what to do about it,QpuNEOFc22Y,2020-08-11T14:09:16Z,PT1H1M30S,888,13,1,0,hd,false
Artificial Intelligence,2020-08-22 18:04:40.772675,Data Science &amp; Artificial Intelligence Career Advice by Real-Life Data Scientists,S8MmsBsGP-Q,2019-12-04T11:56:16Z,PT8M20S,168346,3863,110,0,hd,true
Artificial Intelligence,2020-08-22 18:04:40.772675,Artificial Intelligence Tutorial | Artificial Intelligence Full Course | AI Tutorial | Simplilearn,8Pyy2d3SZuM,2019-10-16T05:30:00Z,PT5H50M2S,93824,2767,58,0,hd,false
Artificial Intelligence,2020-08-22 18:04:40.772675,John Lennox: Should We Fear Artificial Intelligence?,njU4u2hMFnE,2018-10-10T01:59:36Z,PT2H9M27S,189949,3551,153,0,hd,false
Artificial Intelligence,2020-08-22 18:04:40.772675,"Artificial Intelligence At NASA - Interview with Steve Chien, Head of AI, NASA-JPL",29Np5LQ5a1s,2018-10-15T16:05:21Z,PT9M21S,6905,89,0,0,hd,true
Artificial Intelligence,2020-08-22 18:04:40.772675,ARTIFICIAL INTELLIGENCE (An Existential Odyssey) EXPLORED,N4s7EzMeat8,2020-05-31T13:24:44Z,PT16M10S,90963,5412,53,0,hd,false
Artificial Intelligence,2020-08-22 18:04:40.772675,A.I. Artificial Intelligence-David is Abandoned,SYgWHwMm9Uo,2011-04-11T03:11:53Z,PT2M56S,464572,1970,84,0,sd,false
Artificial Intelligence,2020-08-22 18:04:40.772675,Artificial Intelligence In 5 Minutes | What Is Artificial Intelligence? | AI Explained | Simplilearn,ad79nYk2keg,2019-04-30T14:30:01Z,PT5M28S,241284,2799,108,0,hd,false
Artificial Intelligence,2020-08-22 18:04:40.772675,A Brief History of Artificial Intelligence,056v4OxKwlI,2017-09-13T23:44:46Z,PT2M51S,51110,563,26,0,hd,false
Artificial Intelligence,2020-08-22 18:04:40.772675,&quot;Artificial Intelligence and the Future of Work&quot; | Andy Chan | TEDxStLawrenceU,bScAMuegX7Y,2019-05-01T21:53:50Z,PT15M25S,58168,665,61,0,hd,false
Artificial Intelligence,2020-08-22 18:04:40.772675,"ARTIFICIAL INTELLIGENCE ENGINEERING ! IIT-HYDERABAD,NSUT,IIIT-D ! CSE vs CSAI  | ML &amp; AI !",fMhtlrhgUbY,2020-05-29T14:51:26Z,PT12M23S,7338,798,9,0,hd,false
Artificial Intelligence,2020-08-22 18:04:40.772675,HAZIRLANIN! Yapay zeka insan zekasını geçmek üzere...,hbTXsHZBWdI,2019-06-02T06:44:05Z,PT15M21S,1362741,66724,984,0,hd,true
Artificial Intelligence,2020-08-22 18:04:40.772675,Art Bell MITD - Marcus Hutter - Artificial Intelligence,e9B_iXIeZrc,2020-07-25T02:05:08Z,PT2H18M29S,21413,355,17,0,hd,false
Artificial Intelligence,2020-08-22 18:04:40.772675,CryptArithmetic Problem in Artificial Intelligence | TO+GO = OUT &amp; SEND+MORE= MONEY Solutions,aZblDSAx4cg,2020-05-13T10:30:00Z,PT15M22S,1654,35,4,0,hd,false
Artificial Intelligence,2020-08-22 18:04:40.772675,Fuzzy Logic in Artificial Intelligence | Introduction to Fuzzy Logic &amp; Membership Function | Edureka,xD1c8jTFF78,2019-12-18T14:26:34Z,PT19M28S,16622,330,25,0,hd,false
Artificial Intelligence,2020-08-22 18:04:40.772675,الذكاء الصناعي #بدقايق | Artificial Intelligence,8cHZgK3PKGg,2020-08-13T18:10:50Z,PT7M36S,93598,1882,11,0,hd,false
Artificial Intelligence,2020-08-22 18:04:40.772675,Belajar AI (Artificial Intelligence) - Dengan Subtitles,yfe6VR_R9Po,2019-03-10T01:11:16Z,PT19M39S,10975,362,3,0,hd,true
Artificial Intelligence,2020-08-22 18:04:40.772675,Scientist Explains Self Improving Artificial Intelligence,-g0xOJYPjkQ,2020-02-04T20:30:01Z,PT13M36S,253659,4428,124,0,hd,false
Artificial Intelligence,2020-08-22 18:04:40.772675,How Singapore Farms Use Artificial Intelligence,qOGsz-rUx6E,2020-03-10T13:00:12Z,PT2M41S,9087,133,4,0,hd,false
Artificial Intelligence,2020-08-22 18:04:40.772675,Artificial Intelligence &amp; Personhood: Crash Course Philosophy #23,39EdqUbj92U,2016-08-08T22:09:05Z,PT9M26S,738462,16606,188,0,hd,true
Artificial Intelligence,2020-08-22 18:04:40.772675,Google Free Artificial Intelligence Certification Course | Get Foreign University Certificate Free,ez_dv9x5tfI,2020-08-18T05:54:06Z,PT6M29S,10592,654,30,0,hd,false
Artificial Intelligence,2020-08-22 18:04:40.772675,A New Philosophy on Artificial Intelligence | Kristian Hammond | TEDxNorthwesternU,tr9oe2TZiJw,2018-06-08T17:54:39Z,PT20M53S,272980,2816,281,0,hd,false
Artificial Intelligence,2020-08-22 18:04:40.772675,Top 10 Benefits Of Artificial Intelligence | Artificial Intelligence (AI) Advantages | Edureka,masnR4-vt3M,2019-05-27T14:19:33Z,PT13M32S,12517,225,15,0,hd,false
Artificial Intelligence,2020-08-22 18:04:40.772675,Artificial Intelligence Tutorial | AI Tutorial for Beginners | Artificial Intelligence | Simplilearn,FWOZmmIUqHg,2018-05-09T13:11:11Z,PT37M35S,270945,3363,123,0,hd,false
Artificial Intelligence,2020-08-22 18:04:40.772675,Artificial Intelligence Free Course With Certificate | Artificial Intelligence Free Certificate 2020,r9gg0Z6CVQo,2020-07-11T13:12:36Z,PT13M25S,1711,72,4,0,hd,false
Artificial Intelligence,2020-08-22 18:04:40.772675,Understanding Artificial Intelligence and Its Future | Neil Nie | TEDxDeerfield,SN2BZswEWUA,2017-04-10T19:06:42Z,PT16M51S,448503,4894,224,0,hd,false
Artificial Intelligence,2020-08-22 18:04:40.772675,The danger of AI is weirder than you think | Janelle Shane,OhCzX0iLnOc,2019-11-13T23:02:20Z,PT10M30S,1486835,33386,2489,0,hd,false
Artificial Intelligence,2020-08-22 18:04:40.772675,AI คืออะไร? (Artificial Intelligence) | LDA Podcast EP.4,2sGg14-ownA,2020-06-17T01:00:01Z,PT17M37S,6363,206,4,0,hd,false
Artificial Intelligence,2020-08-22 18:04:40.772675,Artificial Intelligence - Free Audiobook &amp; PDF Promo,eVQ0FAjs2-s,2020-08-21T17:16:56Z,PT30S,115,0,0,0,hd,false
Artificial Intelligence,2020-08-22 18:04:40.772675,A DARPA Perspective on Artificial Intelligence,-O01G3tSYpU,2017-02-15T18:32:50Z,PT16M12S,226910,5243,120,0,hd,false
Artificial Intelligence,2020-08-22 18:04:40.772675,Mathematician &amp; Philosopher John Lennox on 2084: Artificial Intelligence and the Future of Humanity,vs4YvzfX3Ro,2020-07-10T03:58:36Z,PT49M6S,62541,2069,61,0,hd,false
Artificial Intelligence,2020-08-22 18:04:40.772675,India Vs China: Technology और Artificial Intelligence की महाशक्ति कैसे बन रहा चीन? (BBC Hindi),aSUpCQpXRSM,2020-07-02T07:46:36Z,PT4M42S,175658,NA,NA,0,hd,false
Artificial Intelligence,2020-08-22 18:04:40.772675,Post Graduate Program in Analytics and Artificial Intelligence,7EPebLkbgj4,2019-12-20T07:00:22Z,PT18S,153771,3,1,0,hd,false
Artificial Intelligence,2020-08-22 18:04:40.772675,Breadth First Search(BFS) in Artificial Intelligence with Solved Examples,SZ2a668G6vA,2020-05-01T06:28:42Z,PT10M58S,3050,47,0,0,hd,false
Artificial Intelligence,2020-08-22 18:04:40.772675,Artificial Intelligence: An Inhuman Future? | Full Panel Discussion | Oxford Union,uqeqnE7CLr8,2019-02-18T19:30:01Z,PT57M57S,26329,435,27,0,hd,false
Artificial Intelligence,2020-08-22 18:04:40.772675,Palantir: THE NEXT BIG IPO?! Best Artificial Intelligence Stock,aD45V0ZQtQs,2020-07-24T17:30:01Z,PT12M15S,47838,3892,73,0,hd,false
Artificial Intelligence,2020-08-22 18:04:40.772675,A.I  Artificial Intelligence Movie Explained in HINDI | Artificial Intelligence Ending Explain,YLFk5CzomHw,2019-02-28T17:10:28Z,PT27M,323388,13296,319,0,hd,false
Artificial Intelligence,2020-08-22 18:04:40.772675,Artificial Intelligence with Python | Artificial Intelligence Tutorial using Python | Edureka,7O60HOZRLng,2019-07-26T14:06:50Z,PT1H42M24S,160749,3110,111,0,hd,false
Artificial Intelligence,2020-08-22 18:04:40.772675,Artificial Intelligence - Mind Field (Ep 4),qZXpgf8N6hs,2017-02-01T17:11:18Z,PT25M,NA,NA,NA,0,hd,true
Artificial Intelligence,2020-08-22 18:04:40.772675,The Hugh Thompson Show: Artificial Intelligence APJ Style,kU2EU5XIrzc,2018-07-29T00:59:04Z,PT53M13S,71073,519,46,0,hd,true
Artificial Intelligence,2020-08-22 18:04:40.772675,Knowledge Representation in AI | Semantic Networks | Artificial Intelligence Tutorial | Edureka,V-O-RFSRe-E,2019-12-27T14:00:12Z,PT17M43S,13359,272,15,0,hd,false
Artificial Intelligence,2020-08-22 18:04:40.772675,Top 10 Terrifying Developments In Artificial Intelligence,Nnf8P5A_saE,2019-09-30T18:00:00Z,PT10M8S,134631,2619,106,0,hd,false
Artificial Intelligence,2020-08-22 18:04:40.772675,"Artificial intelligence 101: machine learning, neural networks, and more",X4-avTeyvXY,2020-08-19T08:53:04Z,PT17M57S,68,5,0,0,hd,false
Artificial Intelligence,2020-08-22 18:04:40.772675,Machine Learning &amp; Artificial Intelligence: Crash Course Computer Science #34,z-EtmaFJieY,2017-11-01T21:50:13Z,PT11M51S,565781,12535,198,0,hd,true
Artificial Intelligence,2020-08-22 18:04:40.772675,&#39;Can&#39;t read a book&#39;: Bill Gates on limitations of artificial intelligence,8cbxii7obvc,2019-11-18T13:01:51Z,PT6M22S,4294,128,2,0,hd,false
Artificial Intelligence,2020-08-22 18:04:40.772675,Artificial Intelligence Tutorial | Artificial Intelligence Course | Intellipaat,W7N6LPp0SmY,2019-06-19T14:38:16Z,PT5H54M15S,463772,15013,438,0,hd,true
Artificial Intelligence,2020-08-22 18:04:40.772675,Should You Go to Grad School for Artificial Intelligence?,qiH6pJkspMs,2020-01-23T05:29:46Z,PT20M26S,6439,240,9,0,hd,false
Artificial Intelligence,2020-08-22 18:04:40.772675,Joe Rogan | How Long Until We Have Real Artificial Intelligence w/Nick Bostrom,Ek7KIIh6f0c,2019-09-12T01:33:25Z,PT20M7S,193947,1947,117,0,hd,false
Artificial Intelligence,2020-08-22 18:04:40.772675,MD vs. Machine: Artificial intelligence in health care,xSDfma4VEx8,2019-04-19T18:37:57Z,PT1H23M46S,40001,620,24,0,hd,true
Artificial Intelligence,2020-08-22 18:04:40.772675,Why study artificial intelligence?,q9TKQ2fw5fI,2018-11-06T00:55:09Z,PT3M15S,14990,334,5,0,hd,false
Artificial Intelligence,2020-08-22 18:04:40.772675,Artificial Intelligence vs Human Intelligence #AnkiCozmoPart2,3VwURrUBHY4,2020-01-20T16:09:16Z,PT10M24S,1016326,70127,2444,0,hd,false
Artificial Intelligence,2020-08-22 18:04:40.772675,Task - Faculty Development Programme on Artificial Intelligence &amp; Deep Learning - Day 1,M6biGjW8M-g,2020-08-17T12:28:08Z,PT51M1S,1688,50,1,0,hd,false
Artificial Intelligence,2020-08-22 18:04:40.772675,Neuroscience and Artificial Intelligence Need Each Other | Marvin Chun | TEDxKFAS,97iYdJE9mQ4,2018-10-29T15:12:46Z,PT22M43S,10788,316,4,0,hd,false
Artificial Intelligence,2020-08-22 18:04:40.772675,Artificial Intelligence | FULL DEBATE | Doha Debates,ffG2EdYxoCQ,2019-04-03T18:52:40Z,PT1H38M18S,22955,415,21,0,hd,true
Artificial Intelligence,2020-08-22 18:04:40.772675,The Truth Behind Artificial Intelligence | Andrew Zeitler | TEDxStMaryCSSchool,clfFT1XOJKM,2017-06-08T16:34:56Z,PT15M37S,519051,3241,861,0,hd,false
Artificial Intelligence,2020-08-22 18:04:40.772675,Artificial Intelligence Meets Mental Health Therapy | Andy Blackwell | TEDxNatick,ZkTvw3usMw4,2020-03-11T17:00:14Z,PT18M46S,34242,1048,37,0,hd,false
Artificial Intelligence,2020-08-22 18:04:40.772675,Natural Language Processing in Artificial Intelligence in Hindi | NLP Easy Explanation,IpBZ01g0pGE,2018-05-24T14:12:28Z,PT7M47S,153720,2475,106,0,hd,false
Artificial Intelligence,2020-08-22 18:04:40.772675,Natural Language Processing in Artificial Intelligence in Hindi | NLP with Demo and Examples,bPpwZxasJo0,2019-05-16T15:03:24Z,PT17M18S,66193,1551,33,0,hd,false
Artificial Intelligence,2020-08-22 18:04:40.772675,Sci-Fi Marathon | Artificial Intelligence | Sunday Night DUST,mOfzF4sahgs,2019-02-18T02:57:45Z,PT1H18M47S,241322,2796,160,0,hd,true
Artificial Intelligence,2020-08-22 18:04:40.772675,Agents in AI | Part-1/2 | Artificial Intelligence | Lec-4 | Bhanu Priya,2iHaSVEadiI,2019-08-22T02:56:00Z,PT12M20S,20923,150,20,0,hd,false
Artificial Intelligence,2020-08-22 18:04:40.772675,NWYR - Artificial Intelligence,dnb0tnBUfz0,2019-04-29T10:00:14Z,PT4M48S,1348999,12974,219,0,hd,false
Artificial Intelligence,2020-08-22 18:04:40.772675,Knowledge - Lecture 1 - CS50&#39;s Introduction to Artificial Intelligence with Python 2020,LucW-p6zC5c,2020-04-10T13:29:32Z,PT1H47M44S,42281,671,4,0,hd,true
Artificial Intelligence,2020-08-22 18:04:40.772675,What is Artificial intelligence and Machine learning || Learning Arena,rQFjJqk2gYw,2020-08-18T13:18:25Z,PT5M4S,66,7,0,0,sd,false
Artificial Intelligence,2020-08-22 18:04:40.772675,Deep Learning Vs Machine Learning | AI Vs Machine Learning Vs Deep Learning,w-8MTXT_N6A,2018-04-25T08:24:29Z,PT2M14S,59818,944,27,0,hd,false
Artificial Intelligence,2020-08-22 18:04:40.772675,Expert Systems | Scope of AI | Artificial intelligence | Lec-45 | Bhanu Priya,l0CRFuA0m_8,2019-09-25T01:26:00Z,PT13M2S,14071,188,7,0,hd,false
Artificial Intelligence,2020-08-22 18:04:40.772675,Neuroscience and Artificial Intelligence Need Each Other | Marvin Chun | TEDxKFAS,97iYdJE9mQ4,2018-10-29T15:12:46Z,PT22M43S,10788,316,4,0,hd,false
Artificial Intelligence,2020-08-22 18:04:40.772675,The Future of Artificial Intelligence: Crash Course AI #20,T7Rv4tGRlfc,2019-12-27T20:00:03Z,PT11M,127607,2915,107,0,hd,true
Artificial Intelligence,2020-08-22 18:04:40.772675,"How artificial intelligence will change your world in 2019, for better or worse",XvzNuw5VjBU,2018-12-24T13:15:01Z,PT4M21S,260893,2509,143,0,hd,false
Artificial Intelligence,2020-08-22 18:04:40.772675,Should You Go to Grad School for Artificial Intelligence?,qiH6pJkspMs,2020-01-23T05:29:46Z,PT20M26S,6439,240,9,0,hd,false
Artificial Intelligence,2020-08-22 18:04:40.772675,Top 10 Applications Of Artificial Intelligence | Artificial Intelligence Applications | Edureka,Y46zXHvUB1s,2019-05-29T05:46:02Z,PT15M39S,71832,1189,64,0,hd,false
Artificial Intelligence,2020-08-22 18:04:40.772675,America&#39;s Most Promising Artificial Intelligence Companies | Forbes,CMnZYAolvdI,2020-07-09T22:00:02Z,PT4M8S,9186,246,10,0,hd,false
Artificial Intelligence,2020-08-22 18:04:40.772675,Crash Course Artificial Intelligence Preview,GvYYFloV0aA,2019-08-02T21:22:49Z,PT3M50S,271553,11230,150,0,hd,true
Artificial Intelligence,2020-08-22 18:04:40.772675,Artificial Intelligence: An Inhuman Future? | Full Panel Discussion | Oxford Union,uqeqnE7CLr8,2019-02-18T19:30:01Z,PT57M57S,26329,435,27,0,hd,false
Artificial Intelligence,2020-08-22 18:04:40.772675,Artificial Intelligence and the future | André LeBlanc | TEDxMoncton,xH_B5xh42xc,2015-01-12T19:28:58Z,PT10M7S,410298,2856,491,0,hd,false
Artificial Intelligence,2020-08-22 18:04:40.772675,Artificial Intelligence Can Change the future of Medical Diagnosis | Shinjini Kundu | TEDxPittsburgh,HrKzXLgGohA,2017-07-18T20:59:23Z,PT12M22S,49642,658,28,0,hd,false
Artificial Intelligence,2020-08-22 18:04:40.772675,Artificial Intelligence Meets Mental Health Therapy | Andy Blackwell | TEDxNatick,ZkTvw3usMw4,2020-03-11T17:00:14Z,PT18M46S,34242,1048,37,0,hd,false
Artificial Intelligence,2020-08-22 18:04:40.772675,Propositional Logic in Artificial Intelligence in Hindi | Knowledge Represenatation| All Imp Points,6490tKrGEic,2020-01-05T11:59:35Z,PT12M20S,26944,727,11,0,hd,false
Artificial Intelligence,2020-08-22 18:04:40.772675,"Knowledge Representation and Reasoning in Artificial Intelligence | Logic, Semantic Net, Frames etc",9iN3O_oL2ac,2019-06-28T12:59:04Z,PT7M45S,63391,1146,33,0,hd,false
Artificial Intelligence,2020-08-22 18:04:40.772675,"What is Artificial Intelligence, Why it is important and how can we learn it?",T4owJSLlelc,2020-08-07T16:32:53Z,PT1H26M23S,5716,387,8,0,hd,false
Artificial Intelligence,2020-08-22 18:04:40.772675,Artificial Intelligence Stembot Kit,wbABEiiRQIY,2018-08-23T19:24:40Z,PT1M9S,1806,3,0,0,hd,false
Artificial Intelligence,2020-08-22 18:04:40.772675,Andrew Ng: Artificial Intelligence is the New Electricity,21EiKfQYZXc,2017-02-02T22:56:12Z,PT1H27M44S,435091,NA,NA,0,hd,true
Artificial Intelligence,2020-08-22 18:04:40.772675,The danger of AI is weirder than you think | Janelle Shane,OhCzX0iLnOc,2019-11-13T23:02:20Z,PT10M30S,1486835,33386,2489,0,hd,false
Artificial Intelligence,2020-08-22 18:04:40.772675,Understanding Artificial Intelligence and Its Future | Neil Nie | TEDxDeerfield,SN2BZswEWUA,2017-04-10T19:06:42Z,PT16M51S,448503,4894,224,0,hd,false
Artificial Intelligence,2020-08-22 18:04:40.772675,Stuart Russell: Long-Term Future of Artificial Intelligence | Lex Fridman Podcast #9,KsZI5oXBC0k,2018-12-09T16:47:24Z,PT1H26M21S,112765,2241,70,0,hd,false
Artificial Intelligence,2020-08-22 18:04:40.772675,How smart is today&#39;s artificial intelligence?,IJKjMIU55pE,2017-12-19T14:00:00Z,PT7M53S,1024265,22466,622,0,hd,true
Artificial Intelligence,2020-08-22 18:04:40.772675,Artificial intelligence and intelligent robots | DW Documentary,71sOQgeq0vw,2019-12-28T19:00:01Z,PT25M56S,261065,2890,268,0,hd,true
Artificial Intelligence,2020-08-22 18:04:40.772675,Google&#39;s Deep Mind Explained! - Self Learning A.I.,TnUYcTuZJpM,2016-05-02T06:02:21Z,PT13M45S,3393631,65951,2021,0,hd,false
Artificial Intelligence,2020-08-22 18:04:40.772675,The three big ethical concerns with artificial intelligence,1LyacmzB1Og,2019-04-09T12:30:00Z,PT2M51S,14977,64,4,0,hd,false
Artificial Intelligence,2020-08-22 18:04:40.772675,B Tech Artificial Intelligence and Data Science in 2020 | Higher Studies Career Selection in Tamil,zMryWtH30EI,2020-07-30T15:43:40Z,PT7M42S,604,35,0,0,hd,false
Artificial Intelligence,2020-08-22 18:04:40.772675,A.I. Artificial Intelligence-David is Abandoned,SYgWHwMm9Uo,2011-04-11T03:11:53Z,PT2M56S,464572,1970,84,0,sd,false
Artificial Intelligence,2020-08-22 18:04:40.772675,India Vs China: Technology और Artificial Intelligence की महाशक्ति कैसे बन रहा चीन? (BBC Hindi),aSUpCQpXRSM,2020-07-02T07:46:36Z,PT4M42S,175658,NA,NA,0,hd,false
Artificial Intelligence,2020-08-22 18:04:40.772675,Joe Rogan | How Long Until We Have Real Artificial Intelligence w/Nick Bostrom,Ek7KIIh6f0c,2019-09-12T01:33:25Z,PT20M7S,193947,1947,117,0,hd,false
Artificial Intelligence,2020-08-22 18:04:40.772675,Artificial Intelligence and Law – An Overview and History | Guest Speaker: Harry Surden,BG6YR0xGMRA,2019-04-08T21:24:10Z,PT1H10M55S,5945,152,2,0,hd,false
Artificial Intelligence,2020-08-22 18:04:40.772675,How Automation and Artificial Intelligence are Changing the Audit,Rz0_ynXyWs0,2020-07-08T16:02:48Z,PT3M32S,182,6,0,0,hd,true
Artificial Intelligence,2020-08-22 18:04:40.772675,What is the difference between artificial intelligence and robotics?,VYA17BrH9rU,2019-09-10T14:08:50Z,PT5M35S,6696,188,3,0,hd,false
Artificial Intelligence,2020-08-22 18:04:40.772675,Artificial Intelligence,_9gIWQ8jzrE,2018-08-10T00:33:14Z,PT3M14S,43085,556,27,0,hd,false
Artificial Intelligence,2020-08-22 18:04:40.772675,All Of Us S4E14 Artificial Intelligence  All of Us Official,7fXpuDbN2iI,2019-12-16T00:15:29Z,PT20M40S,49576,246,17,0,sd,false
Artificial Intelligence,2020-08-22 18:04:40.772675,The Big Picture: Regulating AI - Artificial Intelligence,sBjnvTTFbQA,2020-01-23T16:39:12Z,PT29M7S,47628,1417,13,0,hd,false
Artificial Intelligence,2020-08-22 18:04:40.772675,Alpha Beta Pruning in Hindi with Example | Artificial Intelligence,dEs_kbvu_0s,2019-04-28T10:45:57Z,PT16M21S,132551,2758,84,0,hd,false
Artificial Intelligence,2020-08-22 18:04:40.772675,Breadth First Search with example | Uninformed Search | Artificial Intelligence,qul0f79gxGs,2019-03-30T07:09:03Z,PT12M57S,159630,2915,59,0,hd,false
Artificial Intelligence,2020-08-22 18:04:40.772675,Andrew Ng - The State of Artificial Intelligence,NKpuX_yzdYs,2017-12-15T22:00:01Z,PT29M19S,380633,6432,183,0,hd,false
Artificial Intelligence,2020-08-22 18:04:40.772675,Depth First Search (DFS) with example | Uninformed Search | Artificial Intelligence,f8luGFRtshY,2019-03-31T15:54:56Z,PT9M13S,125738,2091,56,0,hd,false
Artificial Intelligence,2020-08-22 18:04:40.772675,Mathematician &amp; Philosopher John Lennox on 2084: Artificial Intelligence and the Future of Humanity,vs4YvzfX3Ro,2020-07-10T03:58:36Z,PT49M6S,62541,2069,61,0,hd,false
Artificial Intelligence,2020-08-22 18:04:40.772675,What is State Space Search | Introduction to Problem Solving in Artificial Intelligence,E5jVBqe59EE,2019-12-11T12:53:18Z,PT10M47S,53764,762,19,0,hd,false
Artificial Intelligence,2020-08-22 18:04:40.772675,Coursera: Introduction to Artificial Intelligence (AI-IBM) Quiz Answers | All Week Quiz and Answers,xHqNllq0WQo,2020-07-18T18:52:24Z,PT28M6S,8634,144,12,0,hd,false
Artificial Intelligence,2020-08-22 18:04:40.772675,Artificial Intelligence vs Machine Learning vs Deep Learning vs Data Science  in Hindi | ML #02.02,ye1UR39GxbM,2019-06-06T13:30:51Z,PT11M46S,14238,322,6,0,hd,false
Artificial Intelligence,2020-08-22 18:04:40.772675,Technology | Singularity 2029 - AI,8UjNOB97_I4,2018-07-30T21:04:18Z,PT1H59M39S,106652,1019,110,0,hd,false
Artificial Intelligence,2020-08-22 18:04:40.772675,True Artificial Intelligence will change everything | Juergen Schmidhuber | TEDxLakeComo,-Y7PLaxXUrs,2017-11-21T15:00:39Z,PT15M56S,466479,5658,389,0,hd,true
Artificial Intelligence,2020-08-22 18:04:40.772675,Artificial Intelligence Stembot Kit,wbABEiiRQIY,2018-08-23T19:24:40Z,PT1M9S,1806,3,0,0,hd,false
Artificial Intelligence,2020-08-22 18:04:40.772675,What Does Artificial Intelligence Music Sound Like?,8oZiU0MIS6g,2020-05-19T16:00:04Z,PT11M30S,247388,8318,210,0,hd,false
Artificial Intelligence,2020-08-22 18:04:40.772675,Deep Learning Vs Machine Learning | AI Vs Machine Learning Vs Deep Learning,w-8MTXT_N6A,2018-04-25T08:24:29Z,PT2M14S,59818,944,27,0,hd,false
Artificial Intelligence,2020-08-22 18:04:40.772675,Knowledge - Lecture 1 - CS50&#39;s Introduction to Artificial Intelligence with Python 2020,LucW-p6zC5c,2020-04-10T13:29:32Z,PT1H47M44S,42281,671,4,0,hd,true
Artificial Intelligence,2020-08-22 18:04:40.772675,Artificial Intelligence.mp4,TRUOyGN44dg,2011-06-11T19:07:09Z,PT5M37S,67890,283,19,0,sd,false
Artificial Intelligence,2020-08-22 18:04:40.772675,Artificial Intelligence Bomb,4gtGeZ2wOmo,2010-11-14T10:12:14Z,PT2M15S,1121908,35120,123,0,sd,false
Artificial Intelligence,2020-08-22 18:04:40.772675,"What is Artificial Intelligence, Why it is important and how can we learn it?",T4owJSLlelc,2020-08-07T16:32:53Z,PT1H26M23S,5716,387,8,0,hd,false
Artificial Intelligence,2020-08-22 18:04:40.772675,Depth First Search (DFS) with example | Uninformed Search | Artificial Intelligence,f8luGFRtshY,2019-03-31T15:54:56Z,PT9M13S,125738,2091,56,0,hd,false
Artificial Intelligence,2020-08-22 18:04:40.772675,The three big ethical concerns with artificial intelligence,1LyacmzB1Og,2019-04-09T12:30:00Z,PT2M51S,14977,64,4,0,hd,false
Artificial Intelligence,2020-08-22 18:04:40.772675,Man vs. machine: This ETF is beating the market using artificial intelligence,ses7Y5IIrpw,2019-07-29T19:11:59Z,PT6M4S,24193,341,28,0,hd,false
Artificial Intelligence,2020-08-22 18:04:40.772675,What is the difference between artificial intelligence and robotics?,VYA17BrH9rU,2019-09-10T14:08:50Z,PT5M35S,6696,188,3,0,hd,false
Artificial Intelligence,2020-08-22 18:04:40.772675,Breadth First Search with example | Uninformed Search | Artificial Intelligence,qul0f79gxGs,2019-03-30T07:09:03Z,PT12M57S,159630,2915,59,0,hd,false
Artificial Intelligence,2020-08-22 18:04:40.772675,Effect of Artificial Intelligence on Education | Adrien Dubois | TEDxCanadianIntlSchool,-GECSptc9vQ,2018-10-04T20:41:32Z,PT7M22S,14489,162,16,0,hd,false
Artificial Intelligence,2020-08-22 18:04:40.772675,Hill Climbing Algorithm in Artificial Intelligence with Real Life Examples| Heuristic Search,3SiWtAnUROs,2019-12-27T14:50:33Z,PT10M14S,46886,1141,29,0,hd,false
Artificial Intelligence,2020-08-22 18:04:40.772675,America&#39;s Most Promising Artificial Intelligence Companies | Forbes,CMnZYAolvdI,2020-07-09T22:00:02Z,PT4M8S,9186,246,10,0,hd,false
Artificial Intelligence,2020-08-22 18:04:40.772675,The Artificial Intelligence That Deleted A Century,-JlxuQ7tPgQ,2018-12-06T16:00:00Z,PT6M16S,1186320,79795,1852,0,hd,true
Artificial Intelligence,2020-08-22 18:04:40.772675,Artificial Intelligence and Law – An Overview and History | Guest Speaker: Harry Surden,BG6YR0xGMRA,2019-04-08T21:24:10Z,PT1H10M55S,5945,152,2,0,hd,false
Artificial Intelligence,2020-08-22 18:04:40.772675,Artificial Intelligence vs Machine Learning - Gary explains,whlODvf-SVk,2018-01-30T14:00:47Z,PT8M4S,70747,2833,49,0,hd,false
Artificial Intelligence,2020-08-22 18:04:40.772675,Why You Shouldn’t Fear Artificial Intelligence,uEWGjQ0nTm4,2015-01-19T21:00:04Z,PT4M4S,220984,5289,334,0,hd,true
Artificial Intelligence,2020-08-22 18:04:40.772675,2018 Isaac Asimov Memorial Debate: Artificial Intelligence,gb4SshJ5WOY,2018-02-16T22:16:26Z,PT2H2M21S,470055,5066,449,0,hd,true
Artificial Intelligence,2020-08-22 18:04:40.772675,"#AskNASA┃ What Do Beck, NASA and Artificial Intelligence Have in Common?",kz_UTSOfs7o,2020-08-20T17:04:49Z,PT8M54S,31429,1380,123,0,hd,false
Artificial Intelligence,2020-08-22 18:04:40.772675,One Day International E - Workshop on &quot;Role of Artificial Intelligence in Industrial Automation...,tT-qf4OinIY,2020-08-21T07:19:48Z,PT2H30M45S,1106,70,1,0,hd,false
Artificial Intelligence,2020-08-22 18:04:40.772675,What is State Space Search | Introduction to Problem Solving in Artificial Intelligence,E5jVBqe59EE,2019-12-11T12:53:18Z,PT10M47S,53764,762,19,0,hd,false
Artificial Intelligence,2020-08-22 18:04:40.772675,10 differences between artificial intelligence and human intelligence,fxiHM11w-rk,2019-08-07T16:21:21Z,PT6M47S,115847,5262,99,0,hd,true
Artificial Intelligence,2020-08-22 18:04:40.772675,Photoshopped Videos created using Artificial Intelligence!! | Explained by Dhruv Rathee,EW64ikvzHOI,2018-07-14T09:46:25Z,PT16M4S,528389,31336,832,0,hd,true
