Topic,TimeQueried,Video_Title,Video_ID,Published_AT,Duration,ViewCount,LikeCount,DislikeCount,favoriteCount,Definition,Caption
Data Science,2020-08-22 18:04:40.772675,What are the Prerequisites To Learn Data Science,zKhHXveVQlY,2019-11-21T13:30:31Z,PT4M46S,17240,672,9,0,hd,false
Data Science,2020-08-22 18:04:40.772675,Data Science Course - Learn Data Science in 13 hours - Full Course for Beginners - Intellipaat,9l0DAYyJJhI,2019-11-23T06:09:22Z,PT13H22M49S,229974,6025,195,0,hd,true
Data Science,2020-08-22 18:04:40.772675,Statistics for Data Science Course | Probability and Statistics | Learn Statistics Data Science,H52cgidTwXE,2020-05-17T06:40:36Z,PT6H48M9S,28640,686,46,0,hd,false
Data Science,2020-08-22 18:04:40.772675,Data Science vs Computer Science Degree for Data Science Career,v1LZ04WDAOs,2020-03-18T18:39:21Z,PT9M20S,26751,442,16,0,hd,false
Data Science,2020-08-22 18:04:40.772675,Data Science Full Course 2020 | Data Science For Beginners | Data Science from Scratch | Simplilearn,7WRlYJFG7YI,2019-09-18T14:30:01Z,PT9H51M33S,136200,3657,58,0,hd,false
Data Science,2020-08-22 18:04:40.772675,Ciência de dados: como é criar o primeiro projeto de Data Science - TecMundo,L_SZQKv5Cl0,2018-11-16T13:00:03Z,PT6M23S,28837,1840,50,0,hd,false
Data Science,2020-08-22 18:04:40.772675,What is Data Science? | How to become a Data Scientist?,_GJ9IDjHaKU,2019-10-25T14:23:33Z,PT26M4S,52862,1690,26,0,hd,false
Data Science,2020-08-22 18:04:40.772675,Como é ser data scientist no Nubank,umq9kCJFavw,2019-01-16T21:10:09Z,PT4M8S,70493,3884,34,0,hd,true
Data Science,2020-08-22 18:04:40.772675,What is DATA SCIENCE? | Introduction l  R Programming  | Malayalam,vs9U0uQvido,2020-02-19T10:40:17Z,PT9M5S,6919,297,5,0,hd,false
Data Science,2020-08-22 18:04:40.772675,How I Learned Data Science,n3vw0M5RrPU,2020-01-27T14:41:18Z,PT13M26S,60125,1653,162,0,hd,false
Data Science,2020-08-22 18:04:40.772675,What is Data Science? | Data Science in 5 Minutes | Intellipaat,81glyreIXPk,2020-04-16T08:49:58Z,PT6M39S,13528,276,12,0,hd,true
Data Science,2020-08-22 18:04:40.772675,"Data Science, черные ящики – и почему вам сильно повезло",zvGeLvWZ7yQ,2015-09-06T00:09:38Z,PT1H15M30S,134141,3655,121,0,hd,false
Data Science,2020-08-22 18:04:40.772675,3 Strategies to Guarantee a Data Science Job with No Experience,Pkrf8sGe_TQ,2019-08-15T16:48:35Z,PT39M58S,11213,290,3,0,hd,false
Data Science,2020-08-22 18:04:40.772675,"COMMENT DEVENIR DATA SCIENTIST ou data analyst : métier, formation, salaire et Big Data !",cSdDfzFZV7M,2019-01-14T09:29:17Z,PT8M50S,53569,968,18,0,hd,true
Data Science,2020-08-22 18:04:40.772675,"Is Data Science Really a Rising Career in 2020 ($100,000+ Salary)",PXLVLS1vJHY,2020-01-15T16:15:01Z,PT8M27S,55863,1313,37,0,hd,true
Data Science,2020-08-22 18:04:40.772675,MS In Data Science | Salary | Jobs | Course | University Shortlisting Everything Explained,tOD43bHV0mQ,2020-07-19T13:30:06Z,PT21M45S,5366,331,8,0,hd,false
Data Science,2020-08-22 18:04:40.772675,The most important skills of data scientists | Jose Miguel Cansado | TEDxIEMadrid,qrhRfPY4F4w,2017-07-19T15:24:56Z,PT9M54S,175013,2222,136,0,hd,false
Data Science,2020-08-22 18:04:40.772675,Data Scientist vs Data Analyst: What&#39;s the difference?,mcy2dQ3v6R4,2019-01-31T15:04:35Z,PT6M32S,19903,357,8,0,hd,false
Data Science,2020-08-22 18:04:40.772675,Le quotidien d&#39;un Data Scientist,My4uTjtHpeI,2019-02-01T16:00:03Z,PT7M29S,14793,337,9,0,hd,false
Data Science,2020-08-22 18:04:40.772675,"Conoce a William Wolf, profesor de Data Science | Behind Platzi",xqO0KW3O9uU,2016-12-21T19:29:12Z,PT9M31S,23900,458,19,0,hd,false
Data Science,2020-08-22 18:04:40.772675,Amazon Data Science Interview- Part 1 &amp; Internship Opportunities,aK506baLAGA,2020-03-12T13:30:00Z,PT8M2S,18754,616,31,0,hd,false
Data Science,2020-08-22 18:04:40.772675,Real Talk with Reddit Data Scientist,stz12TB72XI,2019-08-20T15:45:00Z,PT12M50S,94384,2064,29,0,hd,false
Data Science,2020-08-22 18:04:40.772675,"ВСЕ, ЧТО ВЫ ХОТЕЛИ ЗНАТЬ: ПРОФЕССИЯ, ЗАРПЛАТА, ИНТЕРВЬЮ, DATA SCIENCE, TOP 5 TECH COMPANIES",OTTWeTd3Ekk,2017-05-15T13:00:02Z,PT32M39S,43032,1517,159,0,hd,false
Data Science,2020-08-22 18:04:40.772675,How to Build A Data Science Portfolio That Can Get You Jobs?,uV59nUgk3BU,2020-04-12T11:35:40Z,PT18M13S,13112,729,11,0,hd,false
Data Science,2020-08-22 18:04:40.772675,A data science como a nova ciência social definitiva | Kaike Nanne,zNoLeZi5gpk,2019-10-07T01:00:06Z,PT51M29S,21847,1187,34,0,hd,false
Data Science,2020-08-22 18:04:40.772675,The NBA Data Scientist,MpLHMKTolVw,2019-05-17T18:43:49Z,PT8M6S,372827,10297,304,0,hd,true
Data Science,2020-08-22 18:04:40.772675,"Get Data Science Courses Worth Rs. 50,000 For Free | Free Data Science Certification By IBM",X5z9qCtjWk0,2020-05-30T12:35:53Z,PT8M35S,18050,1078,47,0,hd,false
Data Science,2020-08-22 18:04:40.772675,Data Science: чему и где учиться – Юрий Дорн,j3H3NTSbgAQ,2020-04-09T15:08:25Z,PT28M29S,2826,74,13,0,hd,false
Data Science,2020-08-22 18:04:40.772675,"Data Science: Что изучать, Статистика или Бизнес Аналитика, Чего стоит успех - Ответы на Вопросы",laAyHS6Lm5s,2018-08-29T16:00:05Z,PT24M23S,13905,488,79,0,hd,false
Data Science,2020-08-22 18:04:40.772675,Real talk with Walmart Data Scientist | Mentor at Springboard,YTBk-WLOKMI,2019-07-21T19:13:13Z,PT14M22S,15181,549,8,0,hd,false
Data Science,2020-08-22 18:04:40.772675,#PeluangKarier: Apakah Data Science adalah karier yang paling dicari di 2019?,0W_d_Utak78,2019-02-15T10:48:30Z,PT6M23S,14655,384,4,0,hd,false
Data Science,2020-08-22 18:04:40.772675,VERİ BİLİMİ ( DATA SCIENCE ) NEDİR ?,bzS-e0yfSp4,2019-07-31T19:06:22Z,PT14M40S,19448,595,16,0,hd,false
Data Science,2020-08-22 18:04:40.772675,Data Science Project - Covid-19 Data Analysis Project using Python | Python Training | Edureka,mKSWAlvXSmw,2020-04-03T07:06:40Z,PT29M31S,47484,747,34,0,hd,false
Data Science,2020-08-22 18:04:40.772675,An absolutely fantastic book for Data Science Beginners!,m7S3RNBhfNA,2020-08-10T16:40:40Z,PT4M25S,29737,1344,20,0,hd,false
Data Science,2020-08-22 18:04:40.772675,Карьера в DATA SCIENCE: TOP-50 Вопросов на собеседовании // PART 1,2AXT1yR5_48,2020-07-28T09:00:00Z,PT12M15S,2214,130,2,0,hd,false
Data Science,2020-08-22 18:04:40.772675,Are Certification Necessary For Data Science?,Ha4dHnYCBOA,2020-05-01T16:54:20Z,PT13M38S,16170,990,13,0,hd,false
Data Science,2020-08-22 18:04:40.772675,How To Become Data Scientist For Free | Get Coursera Data Science Courses For Free | IBM Free Course,hfHBdkHkYDw,2020-06-19T12:33:52Z,PT13M44S,9753,328,34,0,hd,false
Data Science,2020-08-22 18:04:40.772675,A Day In The Life Of A Data Scientist,Ck0ozfJV9-g,2018-07-26T16:00:04Z,PT9M,1175965,20232,1482,0,hd,true
Data Science,2020-08-22 18:04:40.772675,Data Science  กับโควิด Suthichai live 3/8/63,BKB7HXH73ss,2020-08-03T02:46:10Z,PT37M56S,21705,343,18,0,hd,false
Data Science,2020-08-22 18:04:40.772675,"Peluang Karier Data Scientist bersama Ardya Dipta, Senior Data Scientist GOJEK",FCltgGLSt3Q,2019-08-27T03:45:00Z,PT26M21S,53757,1727,14,0,hd,false
Data Science,2020-08-22 18:04:40.772675,"Qual a diferença entre Inteligência Artificial, Machine Learning, Data Science, Deep Learning, etc?",ccZ2pyr3YDw,2019-08-23T14:00:02Z,PT19M56S,148194,12188,103,0,hd,false
Data Science,2020-08-22 18:04:40.772675,3 diferencias entre 💻 R vs Python 🐍 para DATA SCIENCE,doLXHVBbknw,2020-07-17T13:45:16Z,PT6M47S,2646,240,2,0,hd,true
Data Science,2020-08-22 18:04:40.772675,Precisa de FACULDADE pra trabalhar com DATA SCIENCE? | Bit de Prosa #9 (Especial Alura),a6StZPu-16I,2019-10-28T21:00:01Z,PT44M1S,7262,752,6,0,hd,false
Data Science,2020-08-22 18:04:40.772675,Apa itu Data Science? | 60 Seconds Data Science | Episode 1,uf-FTAStfOM,2019-08-22T06:23:35Z,PT1M1S,5263,53,4,0,hd,false
Data Science,2020-08-22 18:04:40.772675,Meet Data Scientists at Google,0jQ25PSyb_E,2018-01-02T17:48:57Z,PT2M18S,69805,1115,31,0,hd,true
Data Science,2020-08-22 18:04:40.772675,5 Ways Data Science Changed Finance,l_FGeEvqYyM,2020-01-22T17:22:10Z,PT12M55S,10136,387,1,0,hd,true
Data Science,2020-08-22 18:04:40.772675,Data Science | Veri Bilimi nedir? Nasıl Veri Bilimci olunur? - Aslında Çok Basit!,NTpxQZAXBbA,2020-01-28T04:30:02Z,PT30M11S,7325,416,19,0,hd,false
Data Science,2020-08-22 18:04:40.772675,Best Data Science Degrees to Get Hired in 2020,2G-fS9Q6Z4M,2020-02-26T17:16:41Z,PT12M30S,44199,922,21,0,hd,true
Data Science,2020-08-22 18:04:40.772675,Data Analyst vs Data Engineer vs Data Scientist | Data Analytics Masters Program | Edureka,ioZNNfxXXqo,2018-12-06T13:36:55Z,PT9M8S,149526,2486,129,0,hd,true
Data Science,2020-08-22 18:04:40.772675,data science- ماهي البيانات وماهي أنواعها؟ ولماذا يجب أن تتعلم مجال علم البيانات؟,7k8JdXqTHZQ,2019-10-01T10:47:56Z,PT6M35S,10999,372,7,0,hd,false
Data Science,2020-08-22 18:04:40.772675,"Get Data Science Courses Worth Rs. 50,000 For Free | Free Data Science Certification By IBM",X5z9qCtjWk0,2020-05-30T12:35:53Z,PT8M35S,18050,1078,47,0,hd,false
Data Science,2020-08-22 18:04:40.772675,Step By Step Action Plan For Learning Data Science in 2020,lP1hb4BFAWA,2020-01-26T14:10:52Z,PT21M6S,163430,5971,88,0,hd,false
Data Science,2020-08-22 18:04:40.772675,Le quotidien d&#39;un Data Scientist,My4uTjtHpeI,2019-02-01T16:00:03Z,PT7M29S,14793,337,9,0,hd,false
Data Science,2020-08-22 18:04:40.772675,IIT Madras Online BSC Degree in Programming &amp; Data Science || Chandan Patel,gTzhwhP1MQU,2020-08-15T09:30:07Z,PT11M14S,1306,73,1,0,hd,false
Data Science,2020-08-22 18:04:40.772675,Data Scientist : นักวิทยาศาสตร์ข้อมูล,SbY1DhAgyGE,2018-10-17T11:30:32Z,PT9M24S,30552,502,7,0,hd,false
Data Science,2020-08-22 18:04:40.772675,Why I left my Data Science Job at FANG (Facebook Amazon Netflix Google),M5v1nXiUaOI,2019-04-12T01:44:41Z,PT15M17S,751845,14980,995,0,hd,true
Data Science,2020-08-22 18:04:40.772675,Salary Of Data Scientist In India And US In 2020,Dt89dX0c7Cw,2020-01-25T17:08:23Z,PT13M32S,68980,1733,43,0,hd,false
Data Science,2020-08-22 18:04:40.772675,Data science applications with TabPy/R,nRtOMTnBz_Y,2018-10-26T15:15:13Z,PT1H1M56S,16362,211,3,0,hd,false
Data Science,2020-08-22 18:04:40.772675,Precisa de FACULDADE pra trabalhar com DATA SCIENCE? | Bit de Prosa #9 (Especial Alura),a6StZPu-16I,2019-10-28T21:00:01Z,PT44M1S,7262,752,6,0,hd,false
Data Science,2020-08-22 18:04:40.772675,Online Launch Event | Applied Data Science Bootcamp by MIT IDSS Faculty | Great Learning,0hK_6_ZusV8,2020-08-21T15:10:06Z,PT1H1M51S,4597,249,2,0,hd,false
Data Science,2020-08-22 18:04:40.772675,Join Data Science Master&#39;s Program &amp; Get 100% Guaranteed Placement,HMnoqPA1xU0,2020-08-20T04:57:53Z,PT16S,10308,6,0,0,hd,false
Data Science,2020-08-22 18:04:40.772675,Apa Itu Data Science?,iApkIuA9jTo,2017-10-23T01:33:07Z,PT1M43S,20104,265,5,0,hd,false
Data Science,2020-08-22 18:04:40.772675,¿Qué es el Big Data Analytics?,uQmcgvxx_g0,2017-03-03T12:42:10Z,PT2M20S,60500,361,6,0,hd,false
Data Science,2020-08-22 18:04:40.772675,Основы Python для Data Science,zqcIjDLxZIM,2019-04-01T17:58:50Z,PT2H16M24S,19817,519,28,0,hd,false
Data Science,2020-08-22 18:04:40.772675,[Kannada] What is Data Science ? | Data scientist Jobs | Kirik Tech,YJH7KGEtX0E,2020-07-25T09:21:59Z,PT6M47S,381,65,0,0,hd,false
Data Science,2020-08-22 18:04:40.772675,"Python for Data Science - Course for Beginners (Learn Python, Pandas, NumPy, Matplotlib)",LHBE6Q9XlzI,2020-06-02T14:05:17Z,PT12H19M52S,259151,9160,84,0,hd,false
Data Science,2020-08-22 18:04:40.772675,Data Science Monash University | Part-time/Full-time JOB | International student Australia Internash,G16PuHXGI30,2020-08-02T07:00:02Z,PT13M12S,3942,194,3,0,sd,false
Data Science,2020-08-22 18:04:40.772675,MSc Data Science in Germany | 10 Data Science Courses in Germany 2020| English taught &amp; Tuition Free,WPB3bmn9w3w,2020-05-12T04:34:44Z,PT24M20S,2310,73,0,0,hd,false
Data Science,2020-08-22 18:04:40.772675,You still don&#39;t have a Data Science Job? 5 things you must do to get one,Gzpa36HKXCQ,2020-08-18T18:01:56Z,PT4M39S,5474,394,3,0,hd,false
Data Science,2020-08-22 18:04:40.772675,"Ghada, alternante en Data Science 🧠 - HEURITECH",CkUAsqb_XfU,2020-04-23T12:37:50Z,PT3M5S,96097,21,2,0,hd,false
Data Science,2020-08-22 18:04:40.772675,data science- ماهي البيانات وماهي أنواعها؟ ولماذا يجب أن تتعلم مجال علم البيانات؟,7k8JdXqTHZQ,2019-10-01T10:47:56Z,PT6M35S,10999,372,7,0,hd,false
Data Science,2020-08-22 18:04:40.772675,"Карьера в Data Science С Нуля: без Технического Образования, Сколько Времени Займет Переквалификация",Ye0AyGKaWOg,2020-08-13T04:00:06Z,PT34M2S,4049,435,9,0,hd,false
Data Science,2020-08-22 18:04:40.772675,Data Scientist vs Data Analyst | Difference Between Data Scientist And Data Analyst | Simplilearn,juZ_Bb9Bpxs,2020-04-27T14:30:06Z,PT12M27S,7709,162,2,0,hd,false
Data Science,2020-08-22 18:04:40.772675,"Energy In Data - Data Science, AI and Me",PigDc_4x_Fc,2020-08-04T15:02:28Z,PT58M8S,2081,56,1,0,hd,false
Data Science,2020-08-22 18:04:40.772675,Colleges For Msc In Data Science and Big Data Analytics In India,83Ohsevj3JM,2020-01-09T13:15:21Z,PT4M30S,12530,295,12,0,hd,false
Data Science,2020-08-22 18:04:40.772675,"Qual a diferença entre Inteligência Artificial, Machine Learning, Data Science, Deep Learning, etc?",ccZ2pyr3YDw,2019-08-23T14:00:02Z,PT19M56S,148194,12188,103,0,hd,false
Data Science,2020-08-22 18:04:40.772675,"Data Science: Что изучать, Статистика или Бизнес Аналитика, Чего стоит успех - Ответы на Вопросы",laAyHS6Lm5s,2018-08-29T16:00:05Z,PT24M23S,13905,488,79,0,hd,false
Data Science,2020-08-22 18:04:40.772675,COVID-19 : décoder les chiffres | Data Science vs Fake | ARTE,MEFnT0Kimtg,2020-04-01T09:12:08Z,PT4M56S,214942,3465,162,0,hd,true
Data Science,2020-08-22 18:04:40.772675,Workshop Data &amp; Machine Learning - Làm sao để bắt đầu?,xvdXi4ejk2w,2018-09-09T03:00:58Z,PT2H13M17S,70202,2055,36,0,hd,false
Data Science,2020-08-22 18:04:40.772675,Live- Data Science Virtual Interview By Krish And Sudhanshu-Part 1,FGjYeKSfLr4,2020-07-24T14:42:06Z,PT51M43S,24697,869,16,0,hd,false
Data Science,2020-08-22 18:04:40.772675,Data Science என்றால் என்ன? | Introduction to Data Science in Tamil | Data Science for Beginners,QgjM0ZbQ06I,2020-05-20T06:30:12Z,PT7M10S,2316,171,3,0,hd,false
Data Science,2020-08-22 18:04:40.772675,What Do You Need to Become a Data Scientist in 2020 vs 2019 vs 2018?,_O9rbyly_go,2020-04-23T15:26:30Z,PT6M47S,18449,357,5,0,hd,true
Data Science,2020-08-22 18:04:40.772675,Data Scientist Insight #4 Mengenal Apa itu Data Science bersama Cornellius Yudha,D0AocXiPNMY,2019-12-10T11:14:29Z,PT9M20S,7803,243,6,0,hd,false
Data Science,2020-08-22 18:04:40.772675,Coronavirus: Durchblick im Zahlenwirrwarr | Data Science vs. Fake | ARTE,WPpkdzfw5LM,2020-04-01T13:00:31Z,PT4M56S,28857,859,102,0,hd,false
Data Science,2020-08-22 18:04:40.772675,Introduction to Coding Ninjas  Data Science Course,c3-b-rhuyQE,2019-04-04T12:57:50Z,PT52S,426078,59,13,0,hd,false
Data Science,2020-08-22 18:04:40.772675,Scikit Learn Tutorial | Machine Learning with Python | Python for Data Science Training | Edureka,bwZ3Qiuj3i8,2018-04-18T12:26:57Z,PT37M8S,136820,1221,161,0,hd,false
Data Science,2020-08-22 18:04:40.772675,Data Science Interview Questions | Data Science Tutorial | Data Science Interviews | Edureka,tTAieUcNHdY,2017-06-20T14:18:48Z,PT1H22M50S,166250,2457,89,0,hd,false
Data Science,2020-08-22 18:04:40.772675,What are the Prerequisites To Learn Data Science,zKhHXveVQlY,2019-11-21T13:30:31Z,PT4M46S,17240,672,9,0,hd,false
Data Science,2020-08-22 18:04:40.772675,NCI Cancer Research Data Commons – Harmonizing Research &amp; Data Science for Better Clinical Outcomes,tk1nEX2gnqk,2020-08-17T14:56:24Z,PT2M20S,718,17,0,0,hd,true
Data Science,2020-08-22 18:04:40.772675,เรียน Data Science ด้วยตัวเอง - Part I,4kdaUIR_HBg,2020-04-29T01:30:02Z,PT11M,6522,237,1,0,hd,false
Data Science,2020-08-22 18:04:40.772675,Data Science: Introdução a Ciência de Dados (Primeira aula prática programando em Python),F608hzn_ygo,2019-09-23T14:00:04Z,PT25M1S,144540,10181,59,0,hd,false
Data Science,2020-08-22 18:04:40.772675,Statistics for Data Science | Probability and Statistics | Statistics Tutorial | Ph.D. (Stanford),Vfo5le26IhY,2019-12-20T07:17:27Z,PT7H12M51S,431508,11496,170,0,hd,true
Data Science,2020-08-22 18:04:40.772675,IBM Data Science Professional Certificate Worth It? REVIEW,uqiydl8tYAM,2020-06-14T09:36:42Z,PT12M58S,7611,129,3,0,hd,false
Data Science,2020-08-22 18:04:40.772675,How to Tackle a Data Science Problem: House Pricing Prediction,QRtw_xDOmm4,2019-07-11T12:41:40Z,PT14M45S,10340,385,7,0,hd,false
Data Science,2020-08-22 18:04:40.772675,"O QUE EU FARIA, SE TIVESSE QUE COMEÇAR DATA SCIENCE HOJE.",VlYDWOfiFuc,2020-08-10T11:48:59Z,PT31M18S,16863,1425,10,0,hd,false
Data Science,2020-08-22 18:04:40.772675,Data Science Interview Questions | Data Science Interview Questions and Answers | Great Learning,4JlmtwH5y94,2020-08-21T10:30:18Z,PT1H22M30S,843,58,0,0,hd,true
Data Science,2020-08-22 18:04:40.772675,Data science: с чего начать?,CiqG7RNflLM,2020-01-30T16:57:25Z,PT1H46M11S,12150,314,15,0,hd,false
Data Science,2020-08-22 18:04:40.772675,Intro to Data Science: What is Data Science?,FsSrzmRawUg,2019-06-06T05:19:06Z,PT8M15S,16015,355,4,0,hd,false
Data Science,2020-08-22 18:04:40.772675,Data Science o Ciencia de Datos ¿Qué es un Data Scientist? - Nuevas Profesiones,4r7-Z55dbKc,2016-07-28T23:05:50Z,PT3M46S,29489,454,18,0,hd,false
Data Science,2020-08-22 18:04:40.772675,ايه الفرق بين ال Big Data و ال Data Science و ال Data Analysis,oXT8luCbuQ4,2018-02-08T10:34:38Z,PT13M39S,108737,5156,82,0,hd,false
Data Science,2020-08-22 18:04:40.772675,Live Virtual Interview For Data Science From Teaching Assistant To Data Scientist,5OQc66PWPtE,2020-08-14T16:18:00Z,PT1H27M37S,13653,515,13,0,sd,false
Data Science,2020-08-22 18:04:40.772675,Intro to Data Science: Overview,pzo13OPXZS4,2019-06-06T04:48:07Z,PT6M12S,31097,592,3,0,hd,false
Data Science,2020-08-22 18:04:40.772675,5 Ways Data Science Changed Finance,l_FGeEvqYyM,2020-01-22T17:22:10Z,PT12M55S,10136,387,1,0,hd,true
Data Science,2020-08-22 18:04:40.772675,"Data Science Insight #2 Python VS R, Manakah yang Lebih Baik untuk Data Science?",tGISLGu86Jo,2018-08-01T08:00:02Z,PT4M24S,9221,166,11,0,hd,false
Data Science,2020-08-22 18:04:40.772675,Code on the iPad Pro | Top 5 iOS Coding Applications | Data Science and Developers,6vxR9tDhbaM,2020-05-13T02:23:33Z,PT13M49S,14536,192,5,0,hd,false
Data Science,2020-08-22 18:04:40.772675,"Data Science, черные ящики – и почему вам сильно повезло",zvGeLvWZ7yQ,2015-09-06T00:09:38Z,PT1H15M30S,134141,3655,121,0,hd,false
Data Science,2020-08-22 18:04:40.772675,Real talk with Walmart Data Scientist | Mentor at Springboard,YTBk-WLOKMI,2019-07-21T19:13:13Z,PT14M22S,15181,549,8,0,hd,false
Data Science,2020-08-22 18:04:40.772675,Book Launch on Data Science,O4zmcrqyzCY,2020-08-15T12:03:26Z,PT32M47S,3579,321,2,0,hd,false
Data Science,2020-08-22 18:04:40.772675,Data Science: A Vision of Things to Come -- Joel Grus -- Keynote at #SDSC2020,D6asD2owXts,2020-08-18T20:37:51Z,PT45M13S,414,31,1,0,hd,false
Data Science,2020-08-22 18:04:40.772675,Top 5 Data Science Certifications | Best Online Data Science Courses | Intellipaat,E8JPcKt31V0,2020-06-23T15:41:43Z,PT27M40S,10912,218,14,0,hd,false
Data Science,2020-08-22 18:04:40.772675,Data Science | ماهو علم البيانات؟ وماهي أهميته؟,DEur2TOEN9c,2020-04-28T06:24:21Z,PT6M40S,4981,223,10,0,hd,false
Data Science,2020-08-22 18:04:40.772675,Data Science Projects for Beginners (Kaggle),8igH8qZafpo,2020-02-17T14:00:04Z,PT7M34S,93177,6441,27,0,hd,false
Data Science,2020-08-22 18:04:40.772675,Data Science | Veri Bilimi nedir? Nasıl Veri Bilimci olunur? - Aslında Çok Basit!,NTpxQZAXBbA,2020-01-28T04:30:02Z,PT30M11S,7325,416,19,0,hd,false
Data Science,2020-08-22 18:04:40.772675,Acing the SQL Data Science Interview,4Cn_vdJNmP4,2020-08-18T19:30:00Z,PT9M12S,523,41,1,0,hd,false
Data Science,2020-08-22 18:04:40.772675,Introduction to Business Analytics | 365 Data Science Online Course,3kMSsb9MFQo,2020-08-12T15:00:00Z,PT38M53S,2827,107,2,0,hd,true
Data Science,2020-08-22 18:04:40.772675,Amazon&#39;s Machine Learning University (FREE Courses in Data Science),Mbe3T2iHbbA,2020-08-18T08:44:13Z,PT14M27S,30295,725,7,0,hd,false
Data Science,2020-08-22 18:04:40.772675,Карьера в DATA SCIENCE: TOP-50 Вопросов на собеседовании // PART 1,2AXT1yR5_48,2020-07-28T09:00:00Z,PT12M15S,2214,130,2,0,hd,false
Data Science,2020-08-22 18:04:40.772675,IIT Madras Online B.Sc Degree/Diploma in Programming &amp; Data Science | Ashish | JAM 2021 | Unacademy,CY54EkCmAMI,2020-07-05T16:41:43Z,PT35M44S,5461,152,20,0,sd,false
Data Science,2020-08-22 18:04:40.772675,075. Карьера в data science: типичные ошибки на собеседовании – Валерий Бабушкин,gGce2JDbJAQ,2018-11-19T19:03:17Z,PT18M23S,58379,1621,97,0,hd,false
Data Science,2020-08-22 18:04:40.772675,How Netflix Data Science Powers Global Entertainment | Caitlin Smallwood (Netflix),0CGQvdAbNcc,2019-04-25T18:25:22Z,PT22M21S,5281,69,2,0,hd,false
Data Science,2020-08-22 18:04:40.772675,PUBG Data Science Tutorial - Part 1 | PUBG Data Analysis | Data Science Training | Edureka,N-E2_Lq4Yzs,2020-04-18T06:38:37Z,PT57M11S,25913,798,19,0,hd,false
Data Science,2020-08-22 18:04:40.772675,Data Science  กับโควิด Suthichai live 3/8/63,BKB7HXH73ss,2020-08-03T02:46:10Z,PT37M56S,21705,343,18,0,hd,false
Data Science,2020-08-22 18:04:40.772675,Data Science Applications | Data Science For Beginners | Data Science Training | Edureka,8Fz2nDfZinE,2018-11-21T13:59:39Z,PT12M51S,8218,167,2,0,hd,false
Data Science,2020-08-22 18:04:40.772675,Tableau Projects for Practice | Tableau Projects for Data Science | Tableau Training | Edureka,If4YqaZtZ3c,2020-03-19T14:00:03Z,PT1H25M8S,13080,265,9,0,hd,false
Data Science,2020-08-22 18:04:40.772675,The Plagiarism Problem in Data Science,vQGJvmhpq_s,2020-08-07T15:00:16Z,PT7M47S,9518,497,7,0,hd,false
Data Science,2020-08-22 18:04:40.772675,What is Data Science?,L7CdHnuR4pE,2016-07-11T20:08:06Z,PT4M24S,179440,958,80,0,hd,false
Data Science,2020-08-22 18:04:40.772675,How I Learned Data Science,n3vw0M5RrPU,2020-01-27T14:41:18Z,PT13M26S,60125,1653,162,0,hd,false
Data Science,2020-08-22 18:04:40.772675,Top 10 Colleges for Data Science Courses in India ll Courses for data analyst ll Meritech Education,h0GyoPf9aLg,2018-07-24T05:30:00Z,PT2M52S,52567,702,62,0,hd,false
Data Science,2020-08-22 18:04:40.772675,Apa itu Data Science? | 60 Seconds Data Science | Episode 1,uf-FTAStfOM,2019-08-22T06:23:35Z,PT1M1S,5263,53,4,0,hd,false
Data Science,2020-08-22 18:04:40.772675,MS In Data Science | Salary | Jobs | Course | University Shortlisting Everything Explained,tOD43bHV0mQ,2020-07-19T13:30:06Z,PT21M45S,5366,331,8,0,hd,false
Data Science,2020-08-22 18:04:40.772675,FREE Online Courses in Data Science from Harvard University,gbOvtkIH5sQ,2020-07-10T12:02:45Z,PT7M58S,6078,339,3,0,hd,false
Data Science,2020-08-22 18:04:40.772675,How to Get an Entry-Level Data Scientist Job?,tJPURyKJAR4,2020-02-12T17:07:09Z,PT9M58S,78898,2427,51,0,hd,true
Data Science,2020-08-22 18:04:40.772675,An absolutely fantastic book for Data Science Beginners!,m7S3RNBhfNA,2020-08-10T16:40:40Z,PT4M25S,29737,1344,20,0,hd,false
Data Science,2020-08-22 18:04:40.772675,Learn Python Basics for Data Science from IBM,JC3urnvKanI,2019-04-04T20:25:17Z,PT2M29S,13810,108,0,0,hd,false
Data Science,2020-08-22 18:04:40.772675,Data Scientist vs Data Analyst: What&#39;s the difference?,mcy2dQ3v6R4,2019-01-31T15:04:35Z,PT6M32S,19903,357,8,0,hd,false
Data Science,2020-08-22 18:04:40.772675,Data science &amp; Engineering @ Manipal,3ZJWBdh01Wc,2020-08-20T09:58:44Z,PT4M26S,519,23,0,0,hd,false
Data Science,2020-08-22 18:04:40.772675,Intro to Data Science - Crash Course for Beginners,N6BghzuFLIg,2019-03-04T18:20:37Z,PT1H39M49S,119345,2408,50,0,hd,false
Data Science,2020-08-22 18:04:40.772675,KNN Algorithm using Python | How KNN Algorithm works | Python Data Science Training | Edureka,6kZ-OPLNcgE,2018-07-11T14:05:54Z,PT19M52S,158411,2018,100,0,hd,false
Data Science,2020-08-22 18:04:40.772675,Real Talk with Levi&#39;s Director of Data Science,S2czDHNFDr4,2019-11-06T00:00:17Z,PT14M10S,26715,224,5,0,hd,false
Data Science,2020-08-22 18:04:40.772675,Introduction to Data Science and its applications by Admond Lee,wRqY7VvH9Y0,2020-05-20T14:39:30Z,PT1H5M1S,5667,189,1,0,hd,false
Data Science,2020-08-22 18:04:40.772675,Are Certification Necessary For Data Science?,Ha4dHnYCBOA,2020-05-01T16:54:20Z,PT13M38S,16170,990,13,0,hd,false
Data Science,2020-08-22 18:04:40.772675,Программист Python: Data-Science специалист,I0FcAPcjwGA,2019-04-24T13:07:59Z,PT12M32S,11557,313,18,0,hd,false
Data Science,2020-08-22 18:04:40.772675,"Data Scientist Job, Career &amp; Salary | Data Scientist Salary | Data Science Masters Program | Edureka",xGPW93ZLhvc,2018-12-11T13:28:03Z,PT13M59S,35658,556,17,0,hd,false
Data Science,2020-08-22 18:04:40.772675,Develop a Data Science Project | Solving a Data Science Problem | Data Science Tutorial | Edureka,VuzXviaNdjk,2015-03-09T09:45:59Z,PT54M35S,47588,380,34,0,hd,false
