Topic,TimeQueried,Video_Title,Video_ID,Published_AT,Duration,ViewCount,LikeCount,DislikeCount,favoriteCount,Definition,Caption
Machine Learning,2020-08-22 18:04:40.772675,"Efficient Computing for Deep Learning, Robotics, and AI (Vivienne Sze) | MIT Deep Learning Series",WbLQqPw_n88,2020-01-23T20:34:56Z,PT1H18M49S,34862,978,12,0,hd,false
Machine Learning,2020-08-22 18:04:40.772675,#11WeeksOfAndroid: Machine Learning week highlights,P-IcDKAlRL4,2020-06-26T17:47:57Z,PT2M12S,11137,237,3,0,hd,true
Machine Learning,2020-08-22 18:04:40.772675,Machine Learning with TensorFlow in JavaScript (with Jason Mayes) — Learn With Jason,WIHZ7kjJ35o,2020-08-19T18:05:57Z,PT1H27M6S,561,34,0,0,hd,false
Machine Learning,2020-08-22 18:04:40.772675,AI: What is Machine Learning?,OeU5m6vRyCk,2019-12-02T19:34:52Z,PT2M56S,12986,191,13,0,hd,true
Machine Learning,2020-08-22 18:04:40.772675,Kart Racing Game with Machine Learning in Unity! (Tutorial),i0Vt7l3XrIU,2020-01-11T18:30:44Z,PT5M30S,176200,3846,58,0,hd,true
Machine Learning,2020-08-22 18:04:40.772675,Cheapest Deep Learning PC in 2020,G6PtQis8GDo,2020-02-10T18:16:39Z,PT12M9S,66154,1559,739,0,hd,false
Machine Learning,2020-08-22 18:04:40.772675,Python Machine Learning Tutorial #1 - Introduction,ujTCoH21GlA,2019-01-16T20:00:05Z,PT11M21S,524662,9909,164,0,hd,true
Machine Learning,2020-08-22 18:04:40.772675,Deep Learning New Frontiers | MIT 6.S191,tfM_DdbGTLs,2020-03-13T17:00:10Z,PT38M10S,83430,1289,23,0,hd,false
Machine Learning,2020-08-22 18:04:40.772675,The Deep End of Deep Learning | Hugo Larochelle | TEDxBoston,dz_jeuWx3j0,2016-10-12T19:08:03Z,PT18M,186545,1726,267,0,hd,false
Machine Learning,2020-08-22 18:04:40.772675,CUDA Explained - Why Deep Learning uses GPUs,6stDhEA0wFQ,2018-09-09T09:38:06Z,PT13M33S,88515,1847,34,0,hd,false
Machine Learning,2020-08-22 18:04:40.772675,How machine learning is being used to help save the world’s bees,sgCGHBek1To,2019-10-24T22:19:44Z,PT1M27S,1579225,5451,141,0,hd,true
Machine Learning,2020-08-22 18:04:40.772675,Artificial Intelligence Full Course | Artificial Intelligence Tutorial for Beginners | Edureka,JMUxmLyrhSk,2019-06-02T08:53:49Z,PT4H52M51S,1058107,23451,424,0,hd,true
Machine Learning,2020-08-22 18:04:40.772675,สอน Python &amp; Machine Learning เบื้องต้น ตอนที่ 1  - รู้จักกับ Machine Learning,c2lhDGiylwo,2020-01-18T18:17:06Z,PT8M24S,17611,456,2,0,hd,false
Machine Learning,2020-08-22 18:04:40.772675,Machine Learning: Making Sense of a Messy World,l95h4alXfAA,2015-11-03T21:00:45Z,PT3M48S,706604,7952,1213,0,hd,true
Machine Learning,2020-08-22 18:04:40.772675,Model Selection and Boosting in Machine Learning - Part 2 | Machine Learning Tutorial | Edureka,Ht4FoHlgmIc,2020-08-21T15:29:09Z,P0D,0,1,0,0,sd,false
Machine Learning,2020-08-22 18:04:40.772675,Comment se former au Machine Learning,M4NZGlse3RM,2018-12-27T12:00:03Z,PT9M56S,13034,518,5,0,hd,true
Machine Learning,2020-08-22 18:04:40.772675,"David Silver: AlphaGo, AlphaZero, and Deep Reinforcement Learning | Lex Fridman Podcast #86",uPUEq8d73JI,2020-04-03T21:16:46Z,PT1H48M1S,133500,4267,57,0,hd,false
Machine Learning,2020-08-22 18:04:40.772675,Cos&#39;è il Machine Learning (Reti Neurali e A.I.),X_ZUyvAA9Qw,2018-10-31T17:20:09Z,PT36M8S,28756,1241,16,0,hd,true
Machine Learning,2020-08-22 18:04:40.772675,A Gentle Introduction to Machine Learning,Gv9_4yMHFhI,2018-11-26T17:00:01Z,PT12M45S,229722,3745,28,0,hd,true
Machine Learning,2020-08-22 18:04:40.772675,Redes Neurais e Machine Learning | Nerdologia Tech,1_c_MA1F-vU,2019-01-31T12:57:40Z,PT9M13S,218019,25461,191,0,hd,false
Machine Learning,2020-08-22 18:04:40.772675,Machine Learning magic for your web application with TensorFlow.js (Chrome Dev Summit 2019),FDUfaYsFQrc,2019-11-25T18:51:56Z,PT8M31S,44415,2041,20,0,hd,true
Machine Learning,2020-08-22 18:04:40.772675,DEEP LEARNING MEME REVIEW - Episode 1,MIEA8azwu1k,2019-09-05T14:30:00Z,PT11M38S,15864,488,10,0,hd,false
Machine Learning,2020-08-22 18:04:40.772675,Lesson 1: Deep Learning 2019 - Image classification,XfoYk_Z5AkI,2019-01-25T16:51:00Z,PT1H40M12S,378568,1486,33,0,hd,true
Machine Learning,2020-08-22 18:04:40.772675,Why Python is the LOVE of all coders | Machine Learning | How to study Python? | Anuj Kumar Sharma,Ro7tVOpaHRQ,2020-04-10T15:13:58Z,PT10M51S,57041,3919,60,0,hd,false
Machine Learning,2020-08-22 18:04:40.772675,Andrew Ng on Building a Career in Machine Learning,4kiHsIaK9_w,2018-12-06T17:58:45Z,PT1H24S,104898,1633,30,0,hd,false
Machine Learning,2020-08-22 18:04:40.772675,A.I. and Machine Learning Master&#39;s Programs at Stevens Institute of Technology,9YXj_ZqC1Uw,2020-07-08T23:56:33Z,PT31S,80520,6,1,0,hd,false
Machine Learning,2020-08-22 18:04:40.772675,Machine Learning Now in Lens Studio | Snap Partner Summit 2020,LAJpCSEPC9g,2020-06-11T18:17:23Z,PT1M30S,6116,NA,NA,0,hd,false
Machine Learning,2020-08-22 18:04:40.772675,DeepMind x UCL | Deep Learning Lectures | 2/12 |  Neural Networks Foundations,FBggC-XVF4M,2020-06-01T10:10:24Z,PT1H24M13S,34389,587,5,0,hd,true
Machine Learning,2020-08-22 18:04:40.772675,Deep Learning: Intelligence from Big Data,czLI3oLDe8M,2014-10-31T20:59:43Z,PT1H24M17S,560143,3837,125,0,hd,false
Machine Learning,2020-08-22 18:04:40.772675,DeepMind x UCL | Deep Learning Lectures | 1/12 | Intro to Machine Learning &amp; AI,7R52wiUgxZI,2020-06-01T10:11:06Z,PT1H25M18S,132473,3257,19,0,hd,true
Machine Learning,2020-08-22 18:04:40.772675,PyWaw #64 - Praktyczny wstęp do Machine Learning,rSkDNZeUpsg,2017-01-13T09:26:24Z,PT37M50S,14813,152,8,0,hd,false
Machine Learning,2020-08-22 18:04:40.772675,Ilya Sutskever: Deep Learning | Lex Fridman Podcast #94,13CZPWmke6A,2020-05-08T21:12:38Z,PT1H37M28S,95815,3251,44,0,hd,false
Machine Learning,2020-08-22 18:04:40.772675,DIFERENCIA ENTRE INTELIGENCIA ARTIFICIAL - MACHINE LEARNING - DEEP LEARNING,6iVUKYgOihQ,2018-04-14T21:46:30Z,PT12M39S,49380,1514,32,0,hd,true
Machine Learning,2020-08-22 18:04:40.772675,Neural Network Architectures and Deep Learning,oJNHXPs0XDk,2019-06-06T05:12:13Z,PT9M9S,445798,17190,219,0,hd,false
Machine Learning,2020-08-22 18:04:40.772675,INTRODUCCIÓN AL CURSO: MACHINE LEARNING CON PYTHON | #0 Curso Machine Learning con Python,4c7oFu36d6k,2018-09-06T13:51:33Z,PT4M14S,101117,2674,13,0,hd,true
Machine Learning,2020-08-22 18:04:40.772675,Deploy and Serve Model from Azure Databricks onto Azure Machine Learning,BkgSE3q7nh0,2020-08-20T15:30:28Z,PT26M20S,477,3,0,0,hd,true
Machine Learning,2020-08-22 18:04:40.772675,Machine Learning Data Lineage with MLflow and Delta Lake,3-YytTKi5fk,2020-08-19T15:52:50Z,PT29M2S,445,9,0,0,hd,true
Machine Learning,2020-08-22 18:04:40.772675,"Yann LeCun: Deep Learning, ConvNets, and Self-Supervised Learning | Lex Fridman Podcast #36",SGSOCuByo24,2019-08-31T15:55:16Z,PT1H15M59S,93520,2911,52,0,hd,false
Machine Learning,2020-08-22 18:04:40.772675,$25000 Deep Learning Workstation liquidcooling build,kztCOkFFegY,2020-02-28T09:06:20Z,PT4M55S,352760,8267,340,0,hd,false
Machine Learning,2020-08-22 18:04:40.772675,Reinforcement Learning for Trading Practical Examples and Lessons Learned by Dr. Tom Starke,c0gpgCyjTM8,2019-09-05T18:31:51Z,PT43M34S,19762,460,15,0,hd,false
Machine Learning,2020-08-22 18:04:40.772675,Python for Machine Learning | Machine Learning For Beginners | Great Learning,WN6gEXamQBc,2020-07-27T07:38:32Z,PT59M58S,12822,407,5,0,hd,false
Machine Learning,2020-08-22 18:04:40.772675,Elasticsearch de Beats a Machine Learning,rOkEM2Ekdfg,2020-08-21T21:15:26Z,PT1H14M51S,34,2,0,0,hd,false
Machine Learning,2020-08-22 18:04:40.772675,Software Engineering or Machine Learning: What&#39;s a better career?,FkqF2Nq062o,2020-08-13T17:15:16Z,PT12M50S,503,65,0,0,hd,false
Machine Learning,2020-08-22 18:04:40.772675,Deep Learning Crash Course for Beginners,VyWAvY2CF9c,2020-07-30T13:30:02Z,PT1H25M39S,40717,1726,25,0,hd,false
Machine Learning,2020-08-22 18:04:40.772675,Deep Learning State of the Art (2019) - MIT,53YvP6gdD7U,2019-01-17T16:50:41Z,PT46M25S,124071,2484,39,0,hd,true
Machine Learning,2020-08-22 18:04:40.772675,Google&#39;s Deep Mind Explained! - Self Learning A.I.,TnUYcTuZJpM,2016-05-02T06:02:21Z,PT13M45S,3393631,65951,2021,0,hd,false
Machine Learning,2020-08-22 18:04:40.772675,Introduction - Deep Learning and Neural Networks with Python and Pytorch p.1,BzcBsTou0C0,2019-09-23T13:57:15Z,PT24M49S,204594,4207,68,0,hd,false
Machine Learning,2020-08-22 18:04:40.772675,Machine Learning: Le Basi (Intelligenza Artificiale) - Gianluca Mauro,iEGE0nxPnnA,2017-12-20T15:06:15Z,PT15M19S,37375,690,36,0,hd,false
Machine Learning,2020-08-22 18:04:40.772675,Scalable Machine Learning with Dask,tQBovBvSDvA,2018-04-17T20:25:06Z,PT29M12S,28934,494,4,0,hd,false
Machine Learning,2020-08-22 18:04:40.772675,Why Deep Learning Now? | AI Revolution Documentary,b3IyDNB_ciI,2018-10-30T16:50:08Z,PT13M46S,319625,13013,185,0,hd,false
Machine Learning,2020-08-22 18:04:40.772675,How to Build a Simple Machine Learning Web App in Python (Streamlit Tutorial Part 2),8M20LyCZDOY,2020-06-12T12:25:54Z,PT8M51S,11973,545,1,0,hd,false
Machine Learning,2020-08-22 18:04:40.772675,Machine Learning Foundations: Ep #4 - Coding with Convolutional Neural Networks,dd8H4fiL9Yc,2020-05-16T16:00:26Z,PT7M6S,16793,372,9,0,hd,true
Machine Learning,2020-08-22 18:04:40.772675,"Deep Learning with PyTorch Live Course - Tensors, Gradient Descent &amp; Linear Regression (Part 1 of 6)",vo_fUOk-IKk,2020-05-23T18:02:44Z,PT2H5M24S,101158,4142,46,0,hd,false
Machine Learning,2020-08-22 18:04:40.772675,Whiteboard Technical Series: Reinforcement Learning,ONKWrJ5koxU,2020-08-21T17:18:09Z,PT4M4S,78,NA,NA,0,hd,false
Machine Learning,2020-08-22 18:04:40.772675,Decision Tree Algorithm | Decision Tree in Python | Machine Learning Algorithms | Edureka,qDcl-FRnwSU,2018-06-14T13:01:33Z,PT46M38S,227283,2508,164,0,hd,false
Machine Learning,2020-08-22 18:04:40.772675,How to Build a Simple Machine Learning Web App in Python (Streamlit Tutorial Part 2),8M20LyCZDOY,2020-06-12T12:25:54Z,PT8M51S,11973,545,1,0,hd,false
Machine Learning,2020-08-22 18:04:40.772675,Feature Selection Techniques Easily Explained | Machine Learning,EqLBAmtKMnQ,2019-06-11T15:41:02Z,PT23M1S,52868,1404,23,0,hd,false
Machine Learning,2020-08-22 18:04:40.772675,This Guy Made a Machine Learning RuneScape PVP Bot,D9e0McRUhvA,2019-10-26T22:53:00Z,PT10M11S,646456,8755,400,0,hd,false
Machine Learning,2020-08-22 18:04:40.772675,Deploy Machine Learning Model using Flask,UbCWoMf80PY,2019-06-16T09:06:04Z,PT13M20S,74782,1478,35,0,hd,false
Machine Learning,2020-08-22 18:04:40.772675,"Daniel Kahneman: Thinking Fast and Slow, Deep Learning, and AI | Lex Fridman Podcast #65",UwwBG-MbniY,2020-01-14T18:09:21Z,PT1H18M41S,113096,3568,65,0,hd,false
Machine Learning,2020-08-22 18:04:40.772675,DEEP LEARNING MEME REVIEW - Episode 1,MIEA8azwu1k,2019-09-05T14:30:00Z,PT11M38S,15864,488,10,0,hd,false
Machine Learning,2020-08-22 18:04:40.772675,Statistics for Machine Learning - 2 | Lec 16 | Machine Learning | GATE CSE 2021 Exam,KJy7cZpjrWk,2020-08-21T17:07:07Z,PT1H2M36S,73,10,1,0,sd,false
Machine Learning,2020-08-22 18:04:40.772675,Deep Learning Full Course - Learn Deep Learning in 6 Hours | Deep Learning Tutorial | Edureka,DooxDIRAkPA,2019-09-08T08:38:47Z,PT6H2M26S,192542,3943,139,0,hd,false
Machine Learning,2020-08-22 18:04:40.772675,Stealing Baseball Signs with a Phone (Machine Learning),PmlRbfSavbI,2019-06-30T17:23:23Z,PT14M9S,13215115,307069,8474,0,hd,true
Machine Learning,2020-08-22 18:04:40.772675,Supervised vs Unsupervised vs Reinforcement Learning | Data Science Certification Training | Edureka,xtOg44r6dsE,2019-01-29T13:45:12Z,PT19M25S,110108,2449,51,0,hd,false
Machine Learning,2020-08-22 18:04:40.772675,"The Convergence of Blockchain, Machine Learning, and the Cloud | Steve Lund | TEDxBYU",LSbceOWZvJg,2018-05-01T17:50:19Z,PT12M39S,132921,1303,101,0,hd,false
Machine Learning,2020-08-22 18:04:40.772675,Machine Learning Fundamentals: Bias and Variance,EuBBz3bI-aA,2018-09-17T16:00:42Z,PT6M36S,362299,10565,115,0,hd,true
Machine Learning,2020-08-22 18:04:40.772675,What Are GANs? | Generative Adversarial Networks Explained | Deep Learning With Python | Edureka,5g1eXmQtl0E,2020-02-17T04:07:44Z,PT14M13S,23934,388,38,0,hd,false
Machine Learning,2020-08-22 18:04:40.772675,A Gentle Introduction to Machine Learning,Gv9_4yMHFhI,2018-11-26T17:00:01Z,PT12M45S,229722,3745,28,0,hd,true
Machine Learning,2020-08-22 18:04:40.772675,"Qual è la differenza tra Intelligenza Artificiale, Machine Learning e Deep Learning?",FOOyYEyZIwY,2018-07-13T13:19:24Z,PT4M48S,7594,276,3,0,hd,false
Machine Learning,2020-08-22 18:04:40.772675,Automated HAV Exposure Monitoring Using Smartwatch and Machine Learning,CWRjpFKQrR0,2020-05-20T03:37:54Z,PT3M58S,166,5,0,0,hd,false
Machine Learning,2020-08-22 18:04:40.772675,Deep Learning: A Crash Course,r0Ogt-q956I,2018-08-13T01:03:22Z,PT3H33M3S,722668,3234,84,0,hd,false
Machine Learning,2020-08-22 18:04:40.772675,Machine Learning with No Code! Using the AutoML UI in the Azure ML Service,JqZDiLnV19E,2020-08-21T12:30:01Z,PT5M26S,52,5,0,0,hd,false
Machine Learning,2020-08-22 18:04:40.772675,BigQuery ML: Machine Learning with Standard SQL,6Kska20zQO4,2019-09-20T16:00:00Z,PT6M8S,12334,380,1,0,hd,true
Machine Learning,2020-08-22 18:04:40.772675,Machine Learning magic for your web application with TensorFlow.js (Chrome Dev Summit 2019),FDUfaYsFQrc,2019-11-25T18:51:56Z,PT8M31S,44415,2041,20,0,hd,true
Machine Learning,2020-08-22 18:04:40.772675,Connections between physics and deep learning,5MdSE-N0bxs,2016-08-30T02:20:55Z,PT51M46S,53721,976,24,0,hd,false
Machine Learning,2020-08-22 18:04:40.772675,Automatic Machine Learning,jn-22XyKsgo,2019-07-23T05:37:24Z,PT12M41S,61543,2270,53,0,hd,false
Machine Learning,2020-08-22 18:04:40.772675,AI 101: What is Machine Learning? | Accenture,JS4AHSlYm0I,2019-02-19T13:07:30Z,PT1M1S,13264,80,2,0,hd,false
Machine Learning,2020-08-22 18:04:40.772675,"Supervised, Unsupervised and Reinforcement Learning in Artificial Intelligence in Hindi",4dwsSz_fNSQ,2019-06-04T15:58:18Z,PT9M29S,101863,2537,62,0,hd,false
Machine Learning,2020-08-22 18:04:40.772675,Introduction to Machine Learning – Professor Mark Whitehorn,wg6l_o-txwQ,2020-08-19T10:54:08Z,PT43M,149,6,0,0,hd,false
Machine Learning,2020-08-22 18:04:40.772675,How Machine Learning Supercharges Website Optimization,7Bnk5eEm1L8,2019-10-31T16:25:53Z,PT2M1S,416,NA,NA,0,hd,false
Machine Learning,2020-08-22 18:04:40.772675,🖥️ TRAINING MY FIRST MACHINE LEARNING GAME! (2/4),OpodKCR6P-M,2017-12-17T18:30:01Z,PT15M4S,665845,22033,319,0,hd,false
Machine Learning,2020-08-22 18:04:40.772675,Machine Learning Fundamentals: Sensitivity and Specificity,vP06aMoz4v8,2019-12-02T14:07:38Z,PT11M47S,52953,1322,9,0,hd,false
Machine Learning,2020-08-22 18:04:40.772675,Artificial Neural Network Tutorial | Deep Learning With Neural Networks | Edureka,fv6Qll3laUU,2017-07-28T15:13:50Z,PT36M40S,135129,1480,56,0,hd,false
Machine Learning,2020-08-22 18:04:40.772675,Learning to perch a UAV on the ground using deep reinforcement learning,uU0WDWV6au8,2016-11-25T07:44:19Z,PT1M59S,29972,64,4,0,hd,false
Machine Learning,2020-08-22 18:04:40.772675,អ្វីទៅជា Machine Learning (ML)? /What is Machine Learning (ML)?,IO0-ieflReQ,2020-04-08T03:43:14Z,PT41M31S,769,38,0,0,hd,false
Machine Learning,2020-08-22 18:04:40.772675,Best Machine Learning Books,JqcdEeu527M,2018-11-15T23:51:17Z,PT6M45S,50017,2771,19,0,hd,false
Machine Learning,2020-08-22 18:04:40.772675,How Far is Too Far? | The Age of A.I.,UwsrzCVZAb8,2019-12-18T17:00:08Z,PT34M40S,44560150,672433,25106,0,hd,true
Machine Learning,2020-08-22 18:04:40.772675,Machine Learning | Kongunadu College of Engineering &amp; Technology | Pantech eLearning,7Z6AXlkT5io,2020-08-15T11:51:50Z,PT1H1M55S,2014,95,0,0,hd,false
Machine Learning,2020-08-22 18:04:40.772675,"TensorFlow and Deep Learning without a PhD, Part 1 (Google Cloud Next &#39;17)",u4alGiomYP4,2017-03-09T03:09:02Z,PT55M52S,313690,4031,91,0,hd,true
Machine Learning,2020-08-22 18:04:40.772675,"Deep Learning with Python, TensorFlow, and Keras tutorial",wQ8BIBpya2k,2018-08-11T14:17:31Z,PT20M34S,744803,12084,208,0,hd,true
Machine Learning,2020-08-22 18:04:40.772675,R1 IR. Haakzaal | Hanna Meyer: &quot;Machine learning in remote sensing applications&quot;,hI_s7rzEb4w,2020-08-19T14:10:49Z,PT1H55M5S,246,14,0,0,hd,false
Machine Learning,2020-08-22 18:04:40.772675,What Matters In On-Policy Reinforcement Learning? A Large-Scale Empirical Study (Paper Explained),a4VvcmqnkhY,2020-08-20T09:46:35Z,PT38M29S,3184,167,2,0,hd,false
Machine Learning,2020-08-22 18:04:40.772675,GOTO 2020 • Keys to Building Machine Learning Systems • Garrett Smith,WZVQEI9KYsk,2020-08-13T12:00:15Z,PT27M13S,1445,40,3,0,hd,false
Machine Learning,2020-08-22 18:04:40.772675,Lecture 3 - Locally Weighted &amp; Logistic Regression | Stanford CS229: Machine Learning (Autumn 2018),het9HFqo1TQ,2020-04-17T20:08:31Z,PT1H19M34S,42240,512,5,0,hd,true
Machine Learning,2020-08-22 18:04:40.772675,How do I select features for Machine Learning?,YaKMeAlHgqQ,2018-11-13T17:00:05Z,PT13M16S,71324,1808,32,0,hd,true
Machine Learning,2020-08-22 18:04:40.772675,Deep Learning - Computerphile,l42lr8AlrHk,2016-04-19T19:13:08Z,PT11M6S,380174,5755,273,0,hd,true
Machine Learning,2020-08-22 18:04:40.772675,CFA Level II: 2020 Quantitative Methods - Machine Learning,ddmo_wLhF2Y,2020-06-20T14:26:13Z,PT44M38S,2843,72,0,0,hd,false
Machine Learning,2020-08-22 18:04:40.772675,Learn Machine Learning in 3 Months (with curriculum),Cr6VqTRO1v0,2018-03-02T11:42:24Z,PT10M5S,705289,30569,555,0,hd,true
Machine Learning,2020-08-22 18:04:40.772675,$25000 Deep Learning Workstation liquidcooling build,kztCOkFFegY,2020-02-28T09:06:20Z,PT4M55S,352760,8267,340,0,hd,false
Machine Learning,2020-08-22 18:04:40.772675,Let’s Write a Pipeline - Machine Learning Recipes #4,84gqSbLcBFE,2016-05-11T17:00:16Z,PT7M54S,452182,5597,79,0,hd,true
Machine Learning,2020-08-22 18:04:40.772675,Part3 Forecast COVID-19 Patients using Machine Learning,CGt2EYjmws0,2020-05-05T14:40:42Z,PT16M18S,351,8,0,0,sd,false
Machine Learning,2020-08-22 18:04:40.772675,Pentagon Space | Introduction | Niche Technology | Artificial Intelligence Course | Machine Learning,zKB3W_XSVbI,2020-08-17T11:59:51Z,PT6M53S,731,90,0,0,hd,false
Machine Learning,2020-08-22 18:04:40.772675,Workshop | Managing the Complete Machine Learning Lifecycle with MLflow: 1 of 3,x3cxvsUFVZA,2020-05-06T17:37:41Z,PT57M39S,6189,134,1,0,hd,true
Machine Learning,2020-08-22 18:04:40.772675,(ML 1.1) Machine learning - overview and applications,yDLKJtOVx5c,2011-06-09T18:16:11Z,PT8M56S,317578,1226,17,0,sd,false
Machine Learning,2020-08-22 18:04:40.772675,How to Make a Prediction - Intro to Deep Learning #1,vOppzHpvTiQ,2017-01-14T01:00:01Z,PT7M52S,562333,8675,331,0,hd,true
Machine Learning,2020-08-22 18:04:40.772675,I used machine learning to make the TV Triss Merigold look like the book and video game Triss,peT0Zuf7AfE,2020-08-15T15:09:41Z,PT1M24S,24966,181,17,0,hd,false
Machine Learning,2020-08-22 18:04:40.772675,Python para Machine Learning (Curso - Aula 1),MmSXHCxDwBs,2019-05-10T20:02:16Z,PT6M35S,30964,1447,2,0,hd,false
Machine Learning,2020-08-22 18:04:40.772675,DAY-3: Online STC on “Applications of Machine Learning in the Advancements of Computer Science”,SOMrVkEw8BM,2020-08-19T11:42:48Z,PT2H48M6S,863,50,1,0,hd,false
Machine Learning,2020-08-22 18:04:40.772675,Lecture 6 - Support Vector Machines | Stanford CS229: Machine Learning (Autumn 2018),lDwow4aOrtg,2020-04-17T20:09:31Z,PT1H20M57S,17592,201,5,0,hd,true
Machine Learning,2020-08-22 18:04:40.772675,Stanford CS224N: NLP with Deep Learning | Winter 2019 | Lecture 1 – Introduction and Word Vectors,8rXD5-xhemo,2019-03-11T19:52:49Z,PT1H21M52S,337234,3820,43,0,hd,true
Machine Learning,2020-08-22 18:04:40.772675,Introduction to Machine Learning | 365 Data Science Online Course,ZgXSXU8lRgU,2020-07-22T15:00:11Z,PT1H1M18S,5318,200,5,0,hd,true
Machine Learning,2020-08-22 18:04:40.772675,"Efficient Computing for Deep Learning, Robotics, and AI (Vivienne Sze) | MIT Deep Learning Series",WbLQqPw_n88,2020-01-23T20:34:56Z,PT1H18M49S,34862,978,12,0,hd,false
Machine Learning,2020-08-22 18:04:40.772675,Machine Learning with TensorFlow in JavaScript (with Jason Mayes) — Learn With Jason,WIHZ7kjJ35o,2020-08-19T18:05:57Z,PT1H27M6S,561,34,0,0,hd,false
Machine Learning,2020-08-22 18:04:40.772675,"David Silver: AlphaGo, AlphaZero, and Deep Reinforcement Learning | Lex Fridman Podcast #86",uPUEq8d73JI,2020-04-03T21:16:46Z,PT1H48M1S,133500,4267,57,0,hd,false
Machine Learning,2020-08-22 18:04:40.772675,Kesha&#39;s Korner - The Machine Learning Lifecycle (Video 2),BqCIjLzcQN0,2020-03-20T18:50:33Z,PT4M5S,261,16,0,0,hd,false
Machine Learning,2020-08-22 18:04:40.772675,INTRODUCCIÓN AL CURSO: MACHINE LEARNING CON PYTHON | #0 Curso Machine Learning con Python,4c7oFu36d6k,2018-09-06T13:51:33Z,PT4M14S,101117,2674,13,0,hd,true
Machine Learning,2020-08-22 18:04:40.772675,Machine Learning Explained - in Hindi,5IsAJU9nkaM,2017-12-29T06:04:24Z,PT4M7S,3918,79,3,0,hd,false
Machine Learning,2020-08-22 18:04:40.772675,How Far is Too Far? | The Age of A.I.,UwsrzCVZAb8,2019-12-18T17:00:08Z,PT34M40S,44560150,672433,25106,0,hd,true
Machine Learning,2020-08-22 18:04:40.772675,Fallout 4 - Intro Cinematic (Colorized using AI Machine Learning) [IMPRESSIVE RESULTS],gYNajpnyZiM,2019-07-21T17:15:49Z,PT3M16S,3084349,113547,2115,0,hd,true
Machine Learning,2020-08-22 18:04:40.772675,Model Selection and Boosting in Machine Learning - Part 1 | Machine Learning Tutorial | Edureka,fvGyjj1dVPg,2020-08-21T15:28:02Z,P0D,0,0,0,0,sd,false
Machine Learning,2020-08-22 18:04:40.772675,How to become a Machine Learning Engineer in 3 Months,ePTuRRPKqxg,2020-05-14T05:52:17Z,PT8M20S,428,12,2,0,hd,false
Machine Learning,2020-08-22 18:04:40.772675,Ilya Sutskever: Deep Learning | Lex Fridman Podcast #94,13CZPWmke6A,2020-05-08T21:12:38Z,PT1H37M28S,95815,3251,44,0,hd,false
Machine Learning,2020-08-22 18:04:40.772675,Deploy and Serve Model from Azure Databricks onto Azure Machine Learning,BkgSE3q7nh0,2020-08-20T15:30:28Z,PT26M20S,477,3,0,0,hd,true
Machine Learning,2020-08-22 18:04:40.772675,Machine Learning Data Lineage with MLflow and Delta Lake,3-YytTKi5fk,2020-08-19T15:52:50Z,PT29M2S,445,9,0,0,hd,true
Machine Learning,2020-08-22 18:04:40.772675,Shower Timer with Machine Learning and WebAssembly,y1n2swhqmt4,2020-05-24T21:35:27Z,PT58S,319,4,0,0,hd,false
Machine Learning,2020-08-22 18:04:40.772675,Elasticsearch de Beats a Machine Learning,rOkEM2Ekdfg,2020-08-21T21:15:26Z,PT1H14M51S,34,2,0,0,hd,false
Machine Learning,2020-08-22 18:04:40.772675,CS8082 Machine Learning Techniques Unit 1 Lecture 1,tASV_LdeS68,2020-05-19T14:47:16Z,PT18M51S,204,7,0,0,hd,false
Machine Learning,2020-08-22 18:04:40.772675,Machine learning 1- 4. 궁리하는 습관,6w766zMm_dc,2020-08-12T12:23:22Z,PT4M37S,9010,188,0,0,hd,false
Machine Learning,2020-08-22 18:04:40.772675,Building a Simple Machine Learning Web App (Boston Housing) in Python (Streamlit Tutorial Part 6),z5HfbXORZsg,2020-08-21T07:11:39Z,PT12M11S,850,59,0,0,hd,false
Machine Learning,2020-08-22 18:04:40.772675,Accelerated Natural Language Processing 1.2 - Introduction to Machine Learning,qpGGR9e1_Fo,2020-08-07T20:00:07Z,PT4M28S,25929,391,0,0,hd,false
Machine Learning,2020-08-22 18:04:40.772675,Throwing a fastball: How the Minnesota Twins are using machine learning to analyze mounds of data,4sPSgESiBlQ,2020-08-20T23:53:08Z,PT13M37S,16,1,0,0,hd,false
Machine Learning,2020-08-22 18:04:40.772675,Алексей Натекин - Мифы Big Data и Machine Learning,tEIkgAsYWb0,2016-01-29T00:48:38Z,PT57M25S,22185,343,52,0,hd,false
Machine Learning,2020-08-22 18:04:40.772675,"Artificial intelligence 101: machine learning, neural networks, and more",X4-avTeyvXY,2020-08-19T08:53:04Z,PT17M57S,68,5,0,0,hd,false
Machine Learning,2020-08-22 18:04:40.772675,Use a machine learning predictive model with streaming patient data: Cloud Pak for Data as a Service,I0Zob8EPoUc,2020-08-19T21:13:24Z,PT6M25S,66,2,0,0,hd,false
Machine Learning,2020-08-22 18:04:40.772675,Data Science &amp; Machine Learning with Python || Class - 6|| by Mrs. Sasmitha on 19-08-2020 @ 8:30PM,UGzoq81quUk,2020-08-20T14:17:37Z,PT1H13M34S,350,7,0,0,hd,false
Machine Learning,2020-08-22 18:04:40.772675,1. Differences: Deep Learning vs Neural Network vs Machine Learning vs AI vs Data Science,XQqUs8mgvDM,2020-08-21T11:16:02Z,PT11M32S,214,28,0,0,hd,false
Machine Learning,2020-08-22 18:04:40.772675,Day 3: Machine Learning Technologies for Social Media Analytics,x6v-_7D8OQQ,2020-08-21T11:42:37Z,PT6H23M18S,258,NA,NA,0,hd,false
Machine Learning,2020-08-22 18:04:40.772675,How to Improve your Machine Learning Skills and Stay on Top of Research,DHO71b1PEes,2020-08-21T11:58:44Z,PT7M58S,344,36,0,0,hd,false
Machine Learning,2020-08-22 18:04:40.772675,Needed Skills for AI &amp; Machine Learning | Deep Learning for NLP and Speech Recognition,Lh1vu7AAG6I,2020-08-20T12:15:01Z,PT2M32S,60,6,0,0,hd,false
Machine Learning,2020-08-22 18:04:40.772675,Score predictive analytic machine learning model using SPSS Modeler: Cloud Pak for Data as a Service,rhrP-Slgeps,2020-08-20T19:13:38Z,PT7M13S,91,3,0,0,hd,false
Machine Learning,2020-08-22 18:04:40.772675,"Enhancement of Underwriting with AI, Machine Learning &amp; Predictive Analytics",qk8q6ar7XvE,2020-08-20T10:09:48Z,PT3M7S,20,2,0,0,hd,false
Machine Learning,2020-08-22 18:04:40.772675,[8K AI] Cyberpunk 2077 - Lifepaths | Machine Learning AI Upscale,gRakbLd4_jw,2020-08-18T17:38:58Z,PT4M6S,1369,55,4,0,hd,false
Machine Learning,2020-08-22 18:04:40.772675,Lesson 1 - Deep Learning for Coders (2020),_QUEXsHfsA0,2020-08-21T17:59:51Z,PT1H22M32S,6037,302,0,0,hd,true
Machine Learning,2020-08-22 18:04:40.772675,Machine Learning And Career Opportunities,_bbjZ_MB5Xs,2020-08-18T13:29:23Z,PT1H20M,1000,68,2,0,hd,false
