Topic,TimeQueried,Video_Title,Video_ID,Published_AT,Duration,ViewCount,LikeCount,DislikeCount,favoriteCount,Definition,Caption,Zscore_Trend,Score
Machine Learning,2020-08-22 18:04:41,How Far is Too Far? | The Age of A.I.,UwsrzCVZAb8,2019-12-18T17:00:08Z,2080,44560150,672433,25106,0,hd,True,0,2.0513496730000003
Machine Learning,2020-08-22 0:45:34,Stealing Baseball Signs with a Phone (Machine Learning),PmlRbfSavbI,2019-06-30T17:23:23Z,849,13186727,306668,8468,0,hd,True,1,1.8707418919999999
Machine Learning,2020-08-22 0:45:34,How Machines Learn,R9OHn5ZF4Uo,2017-12-18T14:39:33Z,535,5042018,338075,2333,0,hd,True,1,1.8314405930000002
Machine Learning,2020-08-22 0:45:34,Fallout 4 - Intro Cinematic (Colorized using AI Machine Learning) [IMPRESSIVE RESULTS],gYNajpnyZiM,2019-07-21T17:15:49Z,196,3083265,113520,2115,0,hd,True,1,1.615797327
Machine Learning,2020-08-22 0:45:34,Hello World - Machine Learning Recipes #1,cKxRvEZd3Mw,2016-03-30T16:59:12Z,413,2468094,54029,547,0,hd,True,1,1.589867378
Machine Learning,2020-08-22 0:45:34,"What is backpropagation really doing? | Deep learning, chapter 3",Ilg3gGewQ5U,2017-11-03T14:03:37Z,834,1964132,35684,301,0,hd,True,1,1.568885954
Machine Learning,2020-08-22 18:04:41,The 7 steps of machine learning,nKW8Ndu7Mjw,2017-08-31T19:19:11Z,636,1807881,29456,712,0,hd,True,1,1.5511378359999999
Machine Learning,2020-08-22 0:45:34,🖥️ WRITING MY FIRST MACHINE LEARNING GAME! (1/4),ZX2Hyu5WoFg,2017-12-08T18:30:01Z,529,1732190,52307,1585,0,hd,True,1,1.547430412
Machine Learning,2020-08-22 0:45:34,How machine learning is being used to help save the world’s bees,sgCGHBek1To,2019-10-24T22:19:44Z,87,1579182,5450,141,0,hd,True,1,1.539782015
Machine Learning,2020-08-22 0:45:34,Artificial Intelligence Full Course | Artificial Intelligence Tutorial for Beginners | Edureka,JMUxmLyrhSk,2019-06-02T08:53:49Z,17571,1056534,23420,424,0,hd,True,1,1.534475319
Machine Learning,2020-08-22 0:45:34,Deep Learning State of the Art (2020) | MIT Deep Learning Series,0VH1Lim8gL8,2020-01-10T16:04:31Z,5262,694978,16913,313,0,hd,True,1,1.5230775730000001
Machine Learning,2020-08-22 0:45:34,11. Introduction to Machine Learning,h0e2HAPTGF4,2017-05-19T14:22:40Z,3091,769348,9837,226,0,hd,True,1,1.521400756
Machine Learning,2020-08-22 18:04:41,MIT Deep Learning Basics: Introduction and Overview,O5xeyoRL95U,2019-01-11T16:47:40Z,4086,655585,12282,259,0,hd,True,1,1.5197550180000001
Machine Learning,2020-08-22 0:45:34,MIT Deep Learning Basics: Introduction and Overview,O5xeyoRL95U,2019-01-11T16:47:40Z,4086,654982,12269,258,0,hd,True,1,1.519752468
Machine Learning,2020-08-22 0:45:34,MIT Introduction to Deep Learning | 6.S191,njKP3FqW3Sk,2020-02-08T14:40:57Z,3172,510542,11294,96,0,hd,True,1,1.5190612119999998
Machine Learning,2020-08-22 18:04:41,What is Artificial Intelligence (or Machine Learning)?,mJeNghZXtMo,2017-01-30T20:19:44Z,375,777650,6503,271,0,hd,True,1,1.518044014
Machine Learning,2020-08-22 18:04:41,AI vs Machine Learning vs Deep Learning | Machine Learning Training with Python | Edureka,WSbgixdC9g8,2018-03-29T15:27:24Z,890,930850,16101,772,0,hd,True,1,1.518039001
Machine Learning,2020-08-22 0:45:34,AI vs Machine Learning vs Deep Learning | Machine Learning Training with Python | Edureka,WSbgixdC9g8,2018-03-29T15:27:24Z,890,930497,16095,772,0,hd,True,1,1.518025736
Machine Learning,2020-08-22 0:45:34,Python Machine Learning Tutorial #1 - Introduction,ujTCoH21GlA,2019-01-16T20:00:05Z,681,524013,9896,164,0,hd,True,1,1.5168069030000002
Machine Learning,2020-08-22 0:45:34,Machine Learning Fundamentals: Bias and Variance,EuBBz3bI-aA,2018-09-17T16:00:42Z,396,361938,10553,115,0,hd,True,1,1.514425381
Machine Learning,2020-08-22 0:45:34,Let’s Write a Pipeline - Machine Learning Recipes #4,84gqSbLcBFE,2016-05-11T17:00:16Z,474,452121,5597,79,0,hd,True,1,1.513631138
Machine Learning,2020-08-22 0:45:34,How to Make a Prediction - Intro to Deep Learning #1,vOppzHpvTiQ,2017-01-14T01:00:01Z,472,562306,8674,331,0,hd,True,1,1.51309656
Machine Learning,2020-08-22 0:45:34,MIT 6.S094: Introduction to Deep Learning and Self-Driving Cars,1L0TKZQcUtA,2017-01-16T17:11:59Z,5489,471947,5480,126,0,hd,True,1,1.5129831
Machine Learning,2020-08-22 0:45:34,Let’s Write a Decision Tree Classifier from Scratch - Machine Learning Recipes #8,LDRbO9a6XPU,2017-09-13T17:21:52Z,593,352213,6243,77,0,hd,True,1,1.511721408
Machine Learning,2020-08-22 0:45:34,Machine Learning Fundamentals: Cross Validation,fSytzGwwBVw,2018-04-24T18:37:54Z,365,255590,8437,109,0,hd,True,1,1.510325497
Machine Learning,2020-08-22 0:45:34,The Mathematics of Machine Learning,Rt6beTKDtqY,2018-11-30T15:00:03Z,994,266343,9166,147,0,hd,True,1,1.510304629
Machine Learning,2020-08-22 0:45:34,Stanford CS224N: NLP with Deep Learning | Winter 2019 | Lecture 1 – Introduction and Word Vectors,8rXD5-xhemo,2019-03-11T19:52:49Z,4912,336783,3813,43,0,hd,True,1,1.510232389
Machine Learning,2020-08-22 0:45:34,Lesson 1: Deep Learning 2019 - Image classification,XfoYk_Z5AkI,2019-01-25T16:51:00Z,6012,378411,1483,33,0,hd,True,1,1.509686207
Machine Learning,2020-08-22 0:45:34,"TensorFlow and Deep Learning without a PhD, Part 1 (Google Cloud Next &#39;17)",u4alGiomYP4,2017-03-09T03:09:02Z,3352,313669,4030,91,0,hd,True,1,1.508765509
Machine Learning,2020-08-22 0:45:34,A Gentle Introduction to Machine Learning,Gv9_4yMHFhI,2018-11-26T17:00:01Z,765,229445,3733,28,0,hd,True,1,1.5078717819999998
Machine Learning,2020-08-22 0:45:34,Linear Regression Algorithm | Linear Regression in Python | Machine Learning Algorithm | Edureka,E5RjzSK0fvY,2018-06-26T14:28:24Z,1716,348294,5405,228,0,hd,True,1,1.507626247
Machine Learning,2020-08-22 0:45:34,Stanford CS234: Reinforcement Learning | Winter 2019 | Lecture 1 - Introduction,FgzM3zpZ55o,2019-03-30T05:04:43Z,3954,237238,2883,58,0,hd,True,1,1.506743489
Machine Learning,2020-08-22 0:45:34,"Noam Chomsky: Language, Cognition, and Deep Learning | Lex Fridman Podcast #53",cMscNuSUy0I,2019-11-29T16:08:32Z,2146,216089,7615,204,0,hd,True,1,1.506614388
Machine Learning,2020-08-22 0:45:34,Machine Learning Methods - Computerphile,qDbpYUbf3e0,2015-09-02T14:51:27Z,641,185324,3657,59,0,hd,True,1,1.5060424590000001
Machine Learning,2020-08-22 0:45:34,Kart Racing Game with Machine Learning in Unity! (Tutorial),i0Vt7l3XrIU,2020-01-11T18:30:44Z,330,176083,3843,58,0,hd,True,1,1.505980883
Machine Learning,2020-08-22 0:45:34,Machine Learning Fundamentals: The Confusion Matrix,Kdsp6soqA7o,2018-10-29T14:00:01Z,433,155424,3746,46,0,hd,True,1,1.505666384
Machine Learning,2020-08-22 0:45:34,The Rise of Artificial Intelligence through Deep Learning | Yoshua Bengio | TEDxMontreal,uawLjkSI7Mo,2017-05-17T20:00:11Z,1074,246254,3551,140,0,hd,True,1,1.505655414
Machine Learning,2020-08-22 0:45:34,DeepMind x UCL | Deep Learning Lectures | 1/12 | Intro to Machine Learning &amp; AI,7R52wiUgxZI,2020-06-01T10:11:06Z,5118,132336,3256,19,0,hd,True,1,1.505323835
Machine Learning,2020-08-22 0:45:34,Neural Networks and Deep Learning: Crash Course AI #3,oV3ZY6tJiA0,2019-08-23T20:45:00Z,743,165535,4322,103,0,hd,True,1,1.5050900580000002
Machine Learning,2020-08-22 0:45:34,Lecture: Mathematics of Big Data and Machine Learning,0sKPkJME2Jw,2018-11-09T22:20:24Z,2296,143512,3069,38,0,hd,True,1,1.505032107
Machine Learning,2020-08-22 0:45:34,Introduction to Deep Learning: Machine Learning vs Deep Learning,-SgkLEuhfbg,2017-04-04T15:07:06Z,228,186674,2063,68,0,hd,True,1,1.5046514480000002
Machine Learning,2020-08-22 0:45:34,FORMATION PYTHON MACHINE LEARNING (2020) (1/30),82KLS2C_gNQ,2019-09-03T14:00:13Z,510,87204,3361,7,0,hd,True,1,1.5045642559999999
Machine Learning,2020-08-22 0:45:34,INTRODUCCIÓN AL CURSO: MACHINE LEARNING CON PYTHON | #0 Curso Machine Learning con Python,4c7oFu36d6k,2018-09-06T13:51:33Z,254,100979,2671,13,0,hd,True,1,1.5042388709999999
Machine Learning,2020-08-22 0:45:34,Deep Learning State of the Art (2019) - MIT,53YvP6gdD7U,2019-01-17T16:50:41Z,2785,124043,2483,39,0,hd,True,1,1.504082379
Machine Learning,2020-08-22 0:45:34,Stanford CS230: Deep Learning | Autumn 2018 | Lecture 8 - Career Advice / Reading Research Papers,733m6qBH-jI,2019-04-04T05:19:28Z,3888,74364,2235,19,0,hd,True,1,1.503117969
Machine Learning,2020-08-22 0:45:34,Introduction to Deep Learning: What Is Deep Learning?,3cSjsTKtN9M,2017-03-27T15:09:37Z,214,111850,1068,25,0,hd,True,1,1.5030077880000001
Machine Learning,2020-08-22 0:45:34,Machine Learning Foundations: Ep #1 - What is ML?,_Z9TRANg4c0,2020-05-06T16:00:26Z,934,57885,2352,11,0,hd,True,1,1.5029814419999998
Machine Learning,2020-08-22 0:45:34,"Machine Learning, Modeling, and Simulation: Engineering Problem-Solving in the Age of AI",mxRurvC-mds,2020-07-27T13:04:57Z,64,104649,24,0,0,hd,True,1,1.50258498
Machine Learning,2020-08-22 0:45:34,Meet our machine learning makers,rsN690cfWsM,2017-11-08T17:08:41Z,118,256259,4112,324,0,hd,True,1,1.502242795
Machine Learning,2020-08-22 0:45:34,Machine Learning magic for your web application with TensorFlow.js (Chrome Dev Summit 2019),FDUfaYsFQrc,2019-11-25T18:51:56Z,511,44390,2041,20,0,hd,True,1,1.5022116419999998
Machine Learning,2020-08-22 0:45:34,Google I/O 2011: Cloud Robotics,FxXBUp-4800,2011-05-12T14:09:12Z,2399,78378,362,14,0,hd,True,1,1.501889139
Machine Learning,2020-08-22 0:45:34,Intro to machine learning on Google Cloud Platform (Google I/O &#39;18),gVz9jKE_9iU,2018-05-10T22:01:03Z,2359,66215,936,24,0,hd,True,1,1.501809427
Machine Learning,2020-08-22 0:45:34,DIFERENCIA ENTRE INTELIGENCIA ARTIFICIAL - MACHINE LEARNING - DEEP LEARNING,6iVUKYgOihQ,2018-04-14T21:46:30Z,759,49310,1512,32,0,hd,True,1,1.501659395
Machine Learning,2020-08-22 0:45:34,"Past, Present and Future of AI / Machine Learning (Google I/O &#39;17)",0ueamFGdOpA,2017-05-19T19:34:09Z,2673,121969,1641,117,0,hd,True,1,1.50165159
Machine Learning,2020-08-22 0:45:34,Lecture 3 - Locally Weighted &amp; Logistic Regression | Stanford CS229: Machine Learning (Autumn 2018),het9HFqo1TQ,2020-04-17T20:08:31Z,4774,41997,510,5,0,hd,True,1,1.501310538
Machine Learning,2020-08-22 0:45:34,Cos&#39;è il Machine Learning (Reti Neurali e A.I.),X_ZUyvAA9Qw,2018-10-31T17:20:09Z,2168,28742,1241,16,0,hd,True,1,1.501302392
Machine Learning,2020-08-22 0:45:34,DeepMind x UCL | Deep Learning Lectures | 2/12 |  Neural Networks Foundations,FBggC-XVF4M,2020-06-01T10:10:24Z,5053,34337,586,5,0,hd,True,1,1.501181039
Machine Learning,2020-08-22 0:45:34,Machine Learning Foundations: Ep #2 - First steps in computer vision,j-35y1M9rRU,2020-05-09T16:00:28Z,1018,27264,734,5,0,hd,True,1,1.501121229
Machine Learning,2020-08-22 0:45:34,Music and Machine Learning (Google I/O&#39;19),pM9u9xcM_cs,2019-05-09T01:00:18Z,2478,30360,492,11,0,hd,True,1,1.500877983
Machine Learning,2020-08-22 0:45:34,"Lecture 2: Machine Learning 1 - Linear Classifiers, SGD | Stanford CS221: AI (Autumn 2019)",zrT2qETJilw,2020-01-08T19:22:26Z,4834,28354,462,8,0,hd,True,1,1.5008724119999999
Machine Learning,2020-08-22 0:45:34,Building Mario Levels with Machine Learning | AI and Games,U-CDQtIJ8eg,2019-05-15T14:00:03Z,1489,26779,903,23,0,hd,True,1,1.500839126
Machine Learning,2020-08-22 0:45:34,Nazirini’s story - using machine learning to tackle crop disease,23Q7HciuVyM,2019-11-13T17:02:26Z,327,26537,712,20,0,hd,True,1,1.5007531769999998
Machine Learning,2020-08-22 0:45:34,Machine Learning Foundations: Ep #3 - Convolutions and pooling,PCgLmzkRM38,2020-05-13T16:01:06Z,697,16340,459,5,0,hd,True,1,1.5006421269999999
Machine Learning,2020-08-22 0:45:34,Making Friends with Machine Learning: Regression,WNvOtwP_yf4,2019-02-04T17:00:13Z,1143,12994,465,4,0,hd,True,1,1.500586895
Machine Learning,2020-08-22 0:45:34,The Difference Between Artificial Intelligence and Machine Learning,ihd9zrW6DOk,2018-05-11T15:59:30Z,293,24337,179,8,0,hd,True,1,1.5005565619999999
Machine Learning,2020-08-22 0:45:34,Machine Learning Foundations: Ep #4 - Coding with Convolutional Neural Networks,dd8H4fiL9Yc,2020-05-16T16:00:26Z,426,16778,372,9,0,hd,True,1,1.500497169
Machine Learning,2020-08-22 0:45:34,#11WeeksOfAndroid: Machine Learning week highlights,P-IcDKAlRL4,2020-06-26T17:47:57Z,132,11116,237,3,0,hd,True,1,1.500387964
Machine Learning,2020-08-22 0:45:34,DeepMind x UCL | Deep Learning Lectures | 5/12 |  Optimization for Machine Learning,kVU8zTI-Od0,2020-06-01T10:10:46Z,5421,14701,240,8,0,hd,True,1,1.500367082
Machine Learning,2020-08-22 0:45:34,Lecture 7 - Kernels | Stanford CS229: Machine Learning (Autumn 2018),8NYoQiRANpg,2020-04-17T20:10:13Z,4825,12294,125,2,0,hd,True,1,1.500353065
Machine Learning,2020-08-22 0:45:34,What’s New in Android Machine Learning (Google I/O&#39;19),wpKJpeOy-68,2019-05-08T18:59:57Z,2555,14506,226,8,0,hd,True,1,1.500351548
Machine Learning,2020-08-22 0:45:34,Machine Learning Foundations: Ep #6 - Convolutional cats and dogs,nq7_ZYJPWf0,2020-05-23T16:00:33Z,725,11292,248,6,0,hd,True,1,1.5003340619999999
Machine Learning,2020-08-22 0:45:34,Azure Machine Learning Studio,JNa4VV0d8T0,2019-11-12T18:00:00Z,542,9302,135,1,0,hd,True,1,1.5003095869999998
Machine Learning,2020-08-22 0:45:34,"Building a $5,000 Machine Learning Workstation with a NVIDIA TITAN RTX and RYZEN ThreadRipper",iahQOQZVdog,2020-07-15T12:21:28Z,981,11316,246,8,0,hd,True,1,1.5002886709999999
Machine Learning,2020-08-22 0:45:34,AI: What is Machine Learning?,OeU5m6vRyCk,2019-12-02T19:34:52Z,176,12920,190,13,0,hd,True,1,1.500173895
Machine Learning,2020-08-22 0:45:34,Lesson 1 - Deep Learning for Coders (2020),_QUEXsHfsA0,2020-08-21T17:59:51Z,4951,2244,98,0,0,hd,True,1,1.500130295
Machine Learning,2020-08-22 0:45:34,Lesson 2 - Deep Learning for Coders (2020),BvHmRx14HQ8,2020-08-21T17:59:51Z,5465,1814,51,0,0,hd,True,1,1.500083655
Machine Learning,2020-08-22 0:45:34,Machine Learning Data Lineage with MLflow and Delta Lake,3-YytTKi5fk,2020-08-19T15:52:50Z,1742,430,9,0,0,hd,True,1,1.5000174569999998
Machine Learning,2020-08-22 0:45:34,TensorFlow In 10 Minutes | TensorFlow Tutorial For Beginners | Deep Learning &amp; TensorFlow | Edureka,tXVNS-V39A0,2019-05-06T13:34:55Z,541,143433,1744,349,0,hd,True,1,1.497101634
Machine Learning,2020-08-22 0:45:34,Machine Learning: Making Sense of a Messy World,l95h4alXfAA,2015-11-03T21:00:45Z,228,706534,7950,1213,0,hd,True,1,1.4964781319999998
Machine Learning,2020-08-22 0:45:34,"Machine Learning: Solving Problems Big, Small, and Prickly",_rdINNHLYaQ,2016-12-12T21:46:37Z,320,635258,7959,1168,0,hd,True,1,1.495736961
Machine Learning,2020-08-22 0:45:34,Tania’s Story: Morse code meets machine learning,Oc_QMQ4QHcw,2018-05-08T17:14:02Z,145,713806,4904,2246,0,hd,True,1,1.471362122
Machine Learning,2020-08-22 18:04:41,Stealing Baseball Signs with a Phone (Machine Learning),PmlRbfSavbI,2019-06-30T17:23:23Z,849,13215115,307069,8474,0,hd,True,0,1.3716127359999999
Machine Learning,2020-08-22 0:45:34,Deep Learning Cars,Aut32pR5PQA,2016-10-23T15:48:14Z,199,4880558,40480,1189,0,hd,False,1,1.124362335
Machine Learning,2020-08-22 18:04:41,Fallout 4 - Intro Cinematic (Colorized using AI Machine Learning) [IMPRESSIVE RESULTS],gYNajpnyZiM,2019-07-21T17:15:49Z,196,3084349,113547,2115,0,hd,True,0,1.115844647
Machine Learning,2020-08-22 0:45:34,"Gradient descent, how neural networks learn | Deep learning, chapter 2",IHZwWFHWa-w,2017-10-16T16:48:20Z,1261,2893337,63995,480,0,hd,True,0,1.109438918
Machine Learning,2020-08-22 18:04:41,Google&#39;s Deep Mind Explained! - Self Learning A.I.,TnUYcTuZJpM,2016-05-02T06:02:21Z,825,3393629,65951,2021,0,hd,False,1,1.088967003
Machine Learning,2020-08-22 18:04:41,Practical Machine Learning Tutorial with Python Intro p.1,OGxgnH8y2NM,2016-04-11T00:18:14Z,355,2153949,19160,230,0,hd,True,0,1.062429302
Machine Learning,2020-08-22 0:45:34,The 7 steps of machine learning,nKW8Ndu7Mjw,2017-08-31T19:19:11Z,636,1807328,29445,712,0,hd,True,0,1.051115826
Machine Learning,2020-08-22 0:45:34,"Backpropagation calculus | Deep learning, chapter 4",tIeHLnjs5U8,2017-11-03T14:08:09Z,618,1199565,25199,194,0,hd,True,0,1.044460417
Machine Learning,2020-08-22 18:04:41,Le deep learning — Science étonnante #27,trWrEWfhTVg,2016-04-08T15:00:03Z,1207,1136618,29471,278,0,hd,True,0,1.044330701
Machine Learning,2020-08-22 0:45:34,Google DeepMind&#39;s Deep Q-learning playing Atari Breakout,V1eYniJ0Rnk,2015-03-07T20:35:17Z,103,1132695,5095,89,0,hd,True,0,1.0297146940000002
Machine Learning,2020-08-22 18:04:41,Learn Machine Learning in 3 Months (with curriculum),Cr6VqTRO1v0,2018-03-02T11:42:24Z,605,705289,30569,555,0,hd,True,0,1.02843999
Machine Learning,2020-08-22 0:45:34,TensorFlow: Open source machine learning,oZikw5k_2FM,2015-11-09T21:34:03Z,138,1423632,9059,638,0,hd,True,0,1.027694406
Machine Learning,2020-08-22 0:45:34,A Friendly Introduction to Machine Learning,IpGxLWOIZy4,2016-09-09T18:10:53Z,1853,821420,12927,200,0,hd,False,1,1.025628594
Machine Learning,2020-08-22 0:45:34,RL Course by David Silver - Lecture 1: Introduction to Reinforcement Learning,2pWv7GOvuf0,2015-05-13T10:58:33Z,5293,859717,7407,69,0,hd,False,1,1.025239778
Machine Learning,2020-08-22 0:45:34,AI Learns to Park - Deep Reinforcement Learning,VMp6pq6_QjI,2019-08-23T10:30:00Z,666,1083722,19468,752,0,hd,False,1,1.024818383
Machine Learning,2020-08-22 0:45:34,"Deep Learning with Python, TensorFlow, and Keras tutorial",wQ8BIBpya2k,2018-08-11T14:17:31Z,1234,744439,12079,207,0,hd,True,0,1.02293383
Machine Learning,2020-08-22 0:45:34,Machine Learning: Living in the Age of AI | A WIRED Film,ZJixNvx9BAc,2019-06-20T16:00:06Z,2477,861642,16323,541,0,hd,False,1,1.021645385
Machine Learning,2020-08-22 0:45:34,Redes Neurais e Machine Learning | Nerdologia Tech,1_c_MA1F-vU,2019-01-31T12:57:40Z,553,217964,25455,191,0,hd,False,1,1.0206496109999998
Machine Learning,2020-08-22 0:45:34,Neural Network Architectures and Deep Learning,oJNHXPs0XDk,2019-06-06T05:12:13Z,549,445620,17185,219,0,hd,False,1,1.019259728
Machine Learning,2020-08-22 18:04:41,Machine Learning &amp; Artificial Intelligence: Crash Course Computer Science #34,z-EtmaFJieY,2017-11-01T21:50:13Z,711,565781,12535,198,0,hd,True,0,1.019102372
Machine Learning,2020-08-22 0:45:34,Machine Learning &amp; Artificial Intelligence: Crash Course Computer Science #34,z-EtmaFJieY,2017-11-01T21:50:13Z,711,565641,12533,198,0,hd,True,0,1.019097403
Machine Learning,2020-08-22 0:45:34,Interview With My Brother Who Sold His Startup For $60 Million | Machine Learning Engineer,fB7nyxXaczY,2019-10-16T14:00:07Z,1760,610886,11564,222,0,hd,False,1,1.018929576
Machine Learning,2020-08-22 0:45:34,Deep Learning: A Crash Course,r0Ogt-q956I,2018-08-13T01:03:22Z,12783,721751,3230,83,0,hd,False,1,1.018337256
Machine Learning,2020-08-22 0:45:34,What is Artificial Intelligence (or Machine Learning)?,mJeNghZXtMo,2017-01-30T20:19:44Z,375,777442,6502,271,0,hd,True,0,1.018038145
Machine Learning,2020-08-22 0:45:34,A friendly introduction to Deep Learning and Neural Networks,BR9h47Jtqyw,2016-12-27T07:21:11Z,2000,578929,11649,257,0,hd,False,1,1.017433333
Machine Learning,2020-08-22 0:45:34,What is machine learning?,WXHM_i-fgGo,2015-07-07T12:48:35Z,685,466947,11534,169,0,hd,False,1,1.016554146
Machine Learning,2020-08-22 0:45:34,Brasileiro programa Inteligência Artificial que aprende a DIRIGIR SOZINHA!!! [Machine Learning],iCbks6Q-xfM,2019-08-01T14:02:29Z,513,332894,27906,663,0,hd,True,0,1.014861859
Machine Learning,2020-08-22 0:45:34,Roadmap: How to Learn Machine Learning in 6 Months,MOdlp1d0PNA,2017-05-27T18:16:14Z,1422,437368,9898,160,0,hd,False,1,1.0147723309999999
Machine Learning,2020-08-22 0:45:34,Python Machine Learning &amp; AI Mega Course - Learn 4 Different Areas of ML &amp; AI,WFr2WgN9_xE,2019-11-23T19:17:47Z,27253,239377,13623,91,0,hd,False,1,1.014310487
Machine Learning,2020-08-22 0:45:34,5 Must Have Skills To Become Machine Learning Engineer,DZ7xuZ1-uh8,2018-02-07T01:06:12Z,295,390757,15510,338,0,hd,False,1,1.013983469
Machine Learning,2020-08-22 0:45:34,Deep Learning: Intelligence from Big Data,czLI3oLDe8M,2014-10-31T20:59:43Z,5057,560136,3837,125,0,hd,False,1,1.0139064309999999
Machine Learning,2020-08-22 0:45:34,Why Deep Learning Now? | AI Revolution Documentary,b3IyDNB_ciI,2018-10-30T16:50:08Z,826,319593,13012,185,0,hd,False,1,1.013719735
Machine Learning,2020-08-22 0:45:34,¿Qué es el Machine Learning?¿Y Deep Learning? Un mapa conceptual | DotCSV,KytW151dpqU,2017-11-01T20:53:19Z,467,254059,9756,75,0,hd,False,1,1.012056427
Machine Learning,2020-08-22 0:45:34,Python Chat Bot Tutorial - Chatbot with Deep Learning (Part 1),wypVcNIH6D4,2019-05-28T00:44:52Z,971,396931,6543,137,0,hd,False,1,1.011715207
Machine Learning,2020-08-22 0:45:34,An introduction to Reinforcement Learning,JgvyzIkgxF0,2018-04-02T20:54:48Z,987,281351,8771,114,0,hd,False,1,1.011102682
Machine Learning,2020-08-22 0:45:34,How Machine Learning Drives the Deceptive World of Deepfakes,gsv1OsCEad0,2019-12-15T11:59:52Z,452,221020,7354,121,0,hd,True,0,1.008379298
Machine Learning,2020-08-22 0:45:34,Mathematics of Machine Learning,8onB7rPG4Pk,2018-03-17T15:30:07Z,593,386317,9141,387,0,hd,True,0,1.0078945879999999
Machine Learning,2020-08-22 18:04:41,Deep Learning - Computerphile,l42lr8AlrHk,2016-04-19T19:13:08Z,666,380174,5755,273,0,hd,True,0,1.0076769159999999
Machine Learning,2020-08-22 0:45:34,Machine Learning Tutorial Part - 1 | Machine Learning Tutorial For Beginners  Part - 1 | Simplilearn,DWsJc1xnOZo,2018-09-27T15:00:04Z,3760,316739,2907,107,0,hd,False,1,1.007622837
Machine Learning,2020-08-22 0:45:34,ML lec 01 - 기본적인 Machine Learning 의 용어와 개념 설명,qPMeuL2LIqY,2016-03-21T12:23:16Z,749,288406,1383,25,0,hd,False,1,1.007579785
Machine Learning,2020-08-22 0:45:34,$25000 Deep Learning Workstation liquidcooling build,kztCOkFFegY,2020-02-28T09:06:20Z,295,352259,8260,340,0,hd,False,1,1.0074271609999998
Machine Learning,2020-08-22 0:45:34,Introduction - Deep Learning and Neural Networks with Python and Pytorch p.1,BzcBsTou0C0,2019-09-23T13:57:15Z,1489,204385,4206,68,0,hd,False,1,1.0067315479999999
Machine Learning,2020-08-22 0:45:34,#4 O QUE É MACHINE LEARNING (INTELIGÊNCIA ARTIFICIAL)? #Descomplicado por Marcelo Tas,Z1YHbl0lh88,2017-04-16T14:00:03Z,323,229219,3987,95,0,hd,False,1,1.006572437
Machine Learning,2020-08-22 18:04:41,Machine Learning APIs by Example (Google I/O &#39;17),ETeeSYMGZn0,2017-05-19T20:53:25Z,2226,216309,3579,67,0,hd,True,0,1.0065647
Machine Learning,2020-08-22 0:45:34,How to Get Started with Machine Learning &amp; AI,nl7kDPYD20A,2019-09-29T16:00:13Z,633,131706,6514,83,0,hd,False,1,1.00638819
Machine Learning,2020-08-22 0:45:34,Machine Learning: Tutorial prático usando apenas o navegador (é sensacional!!!),JyGGMyR3x5I,2019-11-08T14:00:32Z,2575,88142,6423,41,0,hd,False,1,1.006183203
Machine Learning,2020-08-22 0:45:34,Machine Learning With Python | Machine Learning Tutorial | Python Machine Learning | Simplilearn,Q59X518JZHE,2018-03-01T13:47:21Z,3332,209370,2893,60,0,hd,False,1,1.006023254
Machine Learning,2020-08-22 0:45:34,5 Beginner Friendly Steps to Learn Machine Learning,IMMDPzECrf0,2019-09-15T12:00:59Z,822,94930,5706,47,0,hd,False,1,1.005665724
Machine Learning,2020-08-22 18:04:41,The Rise of Artificial Intelligence through Deep Learning | Yoshua Bengio | TEDxMontreal,uawLjkSI7Mo,2017-05-17T20:00:11Z,1074,246344,3553,140,0,hd,True,0,1.005659157
Machine Learning,2020-08-22 0:45:34,Wie funktioniert eigentlich Machine Learning?,ya_6I9IVMzY,2018-03-01T13:24:53Z,491,129387,4975,70,0,hd,True,0,1.005438314
Machine Learning,2020-08-22 0:45:34,Machine Learning Projects for Beginners (Datasets Included),BOhgGA7Eu5E,2019-09-25T13:48:52Z,418,148713,5106,116,0,hd,False,1,1.004990688
Machine Learning,2020-08-22 0:45:34,Logistic Regression in Python | Logistic Regression Example | Machine Learning Algorithms | Edureka,VCJdg7YBbAQ,2018-05-29T13:51:28Z,3221,199147,2816,95,0,hd,False,1,1.004935634
Machine Learning,2020-08-22 0:45:34,Machine Learning Tutorial Python - 2: Linear Regression Single Variable,8jazNUpO3lQ,2018-07-01T19:19:47Z,914,176806,2402,67,0,hd,False,1,1.004691992
Machine Learning,2020-08-22 18:04:41,What is Deep Learning | Deep Learning Simplified | Deep Learning Tutorial | Edureka,dafuAz_CV7Q,2017-05-10T15:56:07Z,1660,214313,2166,102,0,hd,True,0,1.00465286
Machine Learning,2020-08-22 0:45:34,"Deep Learning with PyTorch Live Course - Tensors, Gradient Descent &amp; Linear Regression (Part 1 of 6)",vo_fUOk-IKk,2020-05-23T18:02:44Z,7524,101028,4139,46,0,hd,False,1,1.004634113
Machine Learning,2020-08-22 0:45:34,Machine Learning Tutorial | Learn Machine Learning | Intellipaat,zNhTOPQeRaU,2019-12-14T05:55:32Z,42143,212259,4953,206,0,hd,True,0,1.00443171
Machine Learning,2020-08-22 0:45:34,What is Machine Learning? | Machine Learning Basics | Machine Learning Tutorial | Edureka,Pj0neYUp9Tc,2018-03-16T14:31:00Z,1041,188969,2332,90,0,hd,False,1,1.004425434
Machine Learning,2020-08-22 0:45:34,Support Vector Machine (SVM) Part-1 ll Machine Learning Course Explained in Hindi,xLkk6MUrvrw,2019-04-25T07:22:50Z,467,115435,3671,59,0,hd,False,1,1.0043391609999999
Machine Learning,2020-08-22 0:45:34,Linear Regression Analysis | Linear Regression in Python | Machine Learning Algorithms | Simplilearn,NUXdtN1W1FE,2018-03-26T14:39:17Z,2146,154306,2035,47,0,hd,False,1,1.0043027690000002
Machine Learning,2020-08-22 18:04:41,Getting Started with Weka - Machine Learning Recipes #10,TF1yh5PKaqI,2018-02-22T19:49:42Z,564,142204,1786,31,0,hd,True,0,1.004170292
Machine Learning,2020-08-22 0:45:34,Machine Learning Algorithms | Machine Learning Tutorial | Data Science Algorithms | Simplilearn,I7NrVwm3apg,2018-03-21T14:01:21Z,4265,137017,2161,40,0,hd,False,1,1.004131066
Machine Learning,2020-08-22 0:45:34,The Deep Learning Revolution,Dy0hJWltsyE,2016-06-09T22:52:25Z,156,143678,2436,57,0,hd,False,1,1.004127846
Machine Learning,2020-08-22 0:45:34,Active (Machine) Learning - Computerphile,ANIw1Mz1SRI,2019-04-05T12:21:11Z,371,87168,3019,22,0,hd,False,1,1.003967404
